ダッ シュ ボ ー ド	D_AE1 SH B_AO2 R D
デ ー タ	D_E Y1 T_AH0
デ ー タ ー	D_E Y1 T_AH0
デ ー タ ファ イ ル	D_E Y1 T_AH0 F_A Y1 L
デ ー タ グ ロ ー ブ	D_E Y1 T_AH0 G L_AH1 V
デ ー タ オ ブ ジェ ク ト	D_E Y1 T_AH0 AA1 B JH_EH0 K T
デ ー タ ショ ウ	D_E Y1 T_AH0 SH_O W1
デ ー タ ベ ー ス	D_E Y1 T_AH0 B_E Y2 S
デ ー ツ	D_E Y1 T
デ ー ト	D_E Y1 T
ド ー タ ー	D_AO1 T_E R0
デ ー	D_E Y1
ディ	D_E Y1
デ イ	D_E Y1
デ ー ラ イ ト	D_E Y1 L_A Y2 T
デ イ タ イ ム	D_E Y1 T_A Y2 M
ディ ー ベ ー ス	D_I Y1 B_E Y2 S
デ ス カ レ ー ト	D_I Y1 EH1 S K_AH0 L_E Y2 T
ディ エ ス カ レ ー ト	D_I Y1 EH1 S K_AH0 L_E Y2 T
デ ス カ レ ー ショ ン	D_I Y1 EH2 S K_AH0 L_E Y1 SH_AH0 N
ディ エ ス カ レ ー ショ ン	D_I Y1 EH2 S K_AH0 L_E Y1 SH_AH0 N
デッ ド	D_EH1 D
デッ ド オ ン ア ラ イ バ ル	D_EH1 D AA1 N E R0 A Y1 V_AH0 L
デッ ド ス ロ ー	D_EH1 D S L_O W1
デッ ド ラ イ ン	D_EH1 D L_A Y2 N
デッ ド ロッ ク	D_EH1 D L_AA2 K
ディ ー ラ	D_I Y1 L_E R0
ディ ー ラ ー	D_I Y1 L_E R0
デ イ ー ラ ー	D_I Y1 L_E R0
デ イ ラ	D_I Y1 L_E R0
ディ ラ ー	D_I Y1 L_E R0
デ イ ラ ー	D_I Y1 L_E R0
ディ ー リ ン グ	D_I Y1 L_IH0 N G
ディ ー ン	D_I Y1 N
デ ス	D_EH1 TH
ディ ベ ー ト	D_AH0 B_E Y1 T
デ ビ ア ン	D_EH1 B_I Y2 AH0 N
デ ブ リ	D_AH0 B R_I Y1
デ バッ グ	D_I Y0 B_AH1 G
ディ バッ グ	D_I Y0 B_AH1 G
デ バ グ	D_I Y0 B_AH1 G
デ バッ ギ ン グ	D_I Y0 B_AH1 G_IH0 N G
ド ビュッ シ ー	D_IH0 B_AH1 S_I Y0
デ ビュ ー	D_E Y0 BY_U W1
デ ビュ ウ	D_E Y0 BY_U W1
デ ビュ タ ン ト	D_EH1 BY_AH0 T_AA1 N T
デ カ ダ ン ス	D_EH1 K_AH0 D_AH0 N S
デ カ ダ ン	D_EH1 K_AH0 D_AH0 N T
ディ カ フ	D_I Y1 K_AE0 F
ディ カ フェ	D_I Y1 K_AE0 F
ディ キャ フ	D_I Y1 K_AE0 F
デ カ フェ	D_I Y1 K_AE0 F
デ カ ス ロ ン	D_I Y0 K_AE1 TH L_AO0 N
ディ ケ イ	D_IH0 K_E Y1
デ ケ イ	D_IH0 K_E Y1
ディ セ ン バ ー	D_IH0 S_EH1 M B_E R0
ディ セ ン シ ー	D_I Y1 S_AH0 N S_I Y0
ディ セ ン ト ラ リ ゼ ー ショ ン	D_IH0 S_EH2 N T R_AH0 L_IH0 Z_E Y1 SH_AH0 N
デ シ ベ ル	D_EH1 S_AH0 B_EH2 L
デ シ マ ル	D_EH1 S_AH0 M_AH0 L
デ シ ジョ ン	D_IH0 S_IH1 ZH_AH0 N
デ シ ジョ ン メ ー キ ン グ	D_IH0 S_IH1 ZH_AH0 N M_E Y1 K_IH0 N G
デッ キ	D_EH1 K
デ コ ー ド	D_IH0 K_O W1 D
ディ コ ー ダ ー	D_IH0 K_O W1 D_E R0
デ コ ー ダ	D_IH0 K_O W1 D_E R0
デ コ ー ダ ー	D_IH0 K_O W1 D_E R0
デ コ ー ディ ン グ	D_IH0 K_O W1 D_IH0 N G
ディ コ ン ス ト ラ ク ショ ン	D_I Y0 K_AH0 N S T R_AH1 K SH_AH0 N
デ コ ン ス ト ラ ク ショ ン	D_I Y0 K_AH0 N S T R_AH1 K SH_AH0 N
デ コ レ ー ショ ン	D_EH2 K_E R0 E Y1 SH_AH0 N
デ コ ラ ティ ブ	D_EH1 K R_AH0 T_IH0 V
デ カッ プ リ ン グ	D_I Y0 K_AH1 P L_IH0 N G
デ カ プ リ ン グ	D_I Y0 K_AH1 P L_IH0 N G
デ コ イ	D_AH0 K_O Y1
デ ジ ケ ー ト	D_EH1 D_AH0 K_E Y2 T
デ ディ ケ ー ト	D_EH1 D_AH0 K_E Y2 T
デ ディ ケ ー ショ ン	D_EH2 D_AH0 K_E Y1 SH_AH0 N
ディ ダ ク ショ ン	D_IH0 D_AH1 K SH_AH0 N
デ ダ ク ショ ン	D_IH0 D_AH1 K SH_AH0 N
ディ ー プ	D_I Y1 P
ディ ー プ ス ロ ー ト	D_I Y1 P TH R_O W1 T
ディ ア	D_IH1 R
ディ フォ ー ル ト	D_IH0 F_AO1 L T
ディ フォ ル ト	D_IH0 F_AO1 L T
デ フォ ー ル ト	D_IH0 F_AO1 L T
デ フォ ル ト	D_IH0 F_AO1 L T
デ フ コ ン	D_EH0 F K_AA1 N
ディ フェ ン ド	D_IH0 F_EH1 N S
ディ フェ ン ダ ー	D_IH0 F_EH1 N D_E R0
ディ フェ ン ディ ン グ	D_IH0 F_EH1 N D_IH0 N G
ディ フェ ン ス	D_IH0 F_EH1 N S
デ フェ ン ス	D_IH0 F_EH1 N S
ディ フェ ン シ ブ	D_IH0 F_EH1 N S_IH0 V
ディ フィ ニ ショ ン	D_EH2 F_AH0 N_IH1 SH_AH0 N
デ フィ ニ ショ ン	D_EH2 F_AH0 N_IH1 SH_AH0 N
デ フ レ ー ショ ン	D_IH0 F L_E Y1 SH_AH0 N
デ フ レ ショ ン	D_IH0 F L_E Y1 SH_AH0 N
デ フ レ ー タ ー	D_IH0 F L_E Y1 T_E R0
デ フ ロ ス ト	D_IH0 F R_AO1 S T
ディ グ リ ー	D_IH0 G R_I Y1
デ グ リ ー	D_IH0 G R_I Y1
デ ラ ウェ ア	D_EH1 L_AH0 W_EH2 R
ディ レ ー	D_IH0 L_E Y1
ディ レ イ	D_IH0 L_E Y1
ディ レ イ ラ イ ン	D_IH0 L_E Y1 L_A Y1 N
デ リ ゲ ー ト サ ー バ ー	D_EH1 L_AH0 G_E Y2 T S_E R1 V_E R0
デ リ ゲ ー ショ ン	D_EH2 L_AH0 G_E Y1 SH_AH0 N
デ レ ゲ ー ショ ン	D_EH2 L_AH0 G_E Y1 SH_AH0 N
デ リ ー ト	D_IH0 L_I Y1 T
デ リ カ シ ー	D_EH1 L_AH0 K_AH0 S_I Y0
デ リ ケ ー ト	D_EH1 L_AH0 K_AH0 T
デ リ ケ イ ト	D_EH1 L_AH0 K_AH0 T
デ リ カ テッ セ ン	D_EH2 L_IH0 K_AH0 T_EH1 S_AH0 N
デ リ シャ ス	D_IH0 L_IH1 SH_AH0 S
デ リ バ リ ー	D_IH0 L_IH1 V_E R0 I Y0
デ ル ファ イ	D_EH1 L F_A Y0
デ ラッ ク ス	D_AH0 L_AH1 K S
ディ マ ン ド	D_IH0 M_AE1 N D
デ マ ン ド	D_IH0 M_AE1 N D
デ マ ケ ー ショ ン	D_I Y2 M_AA0 R K_E Y1 SH_AH0 N
デ メ リッ ト	D_I Y0 M_EH1 R_AH0 T
デ ー メ ー テ ー ル	D_IH0 M_I Y1 T_E R0
デ メ テ ル	D_IH0 M_I Y1 T_E R0
デ モ	D_EH1 M_O W0
デ モ ク ラ シ ー	D_IH0 M_AA1 K R_AH0 S_I Y0
デ モ ク ラ シ イ	D_IH0 M_AA1 K R_AH0 S_I Y0
デ モ ク ラッ ト	D_EH1 M_AH0 K R_AE2 T
デ モ ク ラ チッ ク	D_EH2 M_AH0 K R_AE1 T_IH0 K
デ モ ク ラ ティッ ク	D_EH2 M_AH0 K R_AE1 T_IH0 K
デ モ グ ラ フィッ ク	D_EH2 M_AH0 G R_AE1 F_IH0 K
デ モ グ ラ フィ ー	D_IH0 M_AA1 G R_AH0 F_I Y0
デ ー モ ン	D_I Y1 M_AH0 N
デ モ ン ス ト レ ー ショ ン	D_EH2 M_AH0 N S T R_E Y1 SH_AH0 N
デ モ ン ス ト レ ー タ ー	D_EH1 M_AH0 N S T R_E Y2 T_E R0
デ ン	D_EH1 N
デ ン グ	D_EH1 N G
デ ニ ム	D_EH1 N_AH0 M
デ ノ ミ ネ ー ショ ン	D_IH0 N_AO2 M_AH0 N_E Y1 SH_AH0 N
デ ン タ ル	D_EH1 N T_AH0 L
デ ン チャ ー	D_EH1 N CH_E R0
デ ン ヴァ ー	D_EH1 N V_E R0
デ ン バ ー	D_EH1 N V_E R0
デ オ ド ラ ン ト	D_I Y0 O W1 D_E R0 AH0 N T
デ パ ー ト メ ン ト	D_IH0 P_AA1 R T M_AH0 N T
デ パ ー ト メ ン ト ス ト ア	D_IH0 P_AA1 R T M_AH0 N T S T_AO1 R
デ パ ー チャ ー	D_IH0 P_AA1 R CH_E R0
ディ プ リ ー ショ ン	D_IH0 P L_I Y1 SH_AH0 N
デ プ ロ イ	D_IH0 P L_O Y1
デ プ ロ イ メ ン ト	D_IH0 P L_O Y1 M_AH0 N T
デ ポ ジッ ト	D_AH0 P_AA1 Z_IH0 T
デ ポ	D_I Y1 P_O W0
デ ポ ー	D_I Y1 P_O W0
ディ プ レッ ショ ン	D_IH0 P R_EH1 SH_AH0 N
デ プ レッ ショ ン	D_IH0 P R_EH1 SH_AH0 N
ダ ー ビ ー	D_E R1 B_I Y0
ディ レ ギュ レ ー ショ ン	D_I Y0 R_EH2 GY_AH0 L_E Y1 SH_AH0 N
デ レ ギュ レ ー ショ ン	D_I Y0 R_EH2 GY_AH0 L_E Y1 SH_AH0 N
デ リ バ ティ ブ	D_E R0 IH1 V_AH0 T_IH0 V
デ ラ イ ブ ド	D_E R0 A Y1 V D
デ リッ ク	D_EH1 R_IH0 K
デ リ ン ジャ ー	D_EH1 R_AH0 N JH_E R0
ディ ス ク ラ イ ブ	D_IH0 S K R_A Y1 B
デ ス ク リ プ ショ ン	D_IH0 S K R_IH1 P SH_AH0 N
ディ ス ク リ プ タ	D_IH0 S K R_IH1 P T_E R2
デ ス ク リ プ タ	D_IH0 S K R_IH1 P T_E R2
デ ザ イ ン	D_IH0 Z_A Y1 N
デ ザ イ ン イ ン	D_IH0 Z_A Y1 N IH0 N
デ ザ イ ナ ー	D_IH0 Z_A Y1 N_E R0
ディ ザ イ ア	D_IH0 Z_A Y1 E R0
ディ ザ イ ア ー	D_IH0 Z_A Y1 E R0
デ ザ イ ア	D_IH0 Z_A Y1 E R0
デ ザ イ ア ー	D_IH0 Z_A Y1 E R0
デ ス ク	D_EH1 S K
ディ ス ク トッ プ	D_EH1 S K T_AA2 P
デ ス ク トッ プ	D_EH1 S K T_AA2 P
デ ス ポッ ト	D_EH1 S P_AH0 T
デ ス ポ ティ ズ ム	D_EH1 S P_AH0 T_IH2 Z_AH0 M
デ サ ー ル	D_IH0 Z_E R1 T
デ セ ー ル	D_IH0 Z_E R1 T
デ ザ ー ト	D_IH0 Z_E R1 T
ディ ス ティ ネ ー ショ ン	D_EH2 S T_AH0 N_E Y1 SH_AH0 N
デ ス ティ ネ ー ショ ン	D_EH2 S T_AH0 N_E Y1 SH_AH0 N
デ ス ティ ニ ー	D_EH1 S T_AH0 N_I Y0
デ ス ト ロ イ ヤ ー	D_IH0 S T R_O Y1 E R0
デ タッ チ	D_IH1 T_AE2 CH
デ タッ チ ト コ ー ト	D_IH0 T_AE1 CH T K_O W1 T
ディ ー テ イ ル	D_IH0 T_E Y1 L
ディ テ ー ル	D_IH0 T_E Y1 L
ディ ティ ー ル	D_IH0 T_E Y1 L
デ テ ー ル	D_IH0 T_E Y1 L
ディ ー テ イ リ ン グ	D_IH0 T_E Y1 L_IH0 N G
ダッ チ マ ン	D_AH1 CH M_AH0 N
ディ テ ク ショ ン	D_IH0 T_EH1 K SH_AH0 N
ディ ティ ク ティ ブ	D_IH0 T_EH1 K T_IH0 V
ディ テ ク ティ ブ	D_IH0 T_EH1 K T_IH0 V
デ テ ク ティ ブ	D_IH0 T_EH1 K T_IH0 V
ディ テ ク タ	D_IH0 T_EH1 K T_E R0
ディ テ ク タ ー	D_IH0 T_EH1 K T_E R0
デ テ ク タ ー	D_IH0 T_EH1 K T_E R0
デ タ ン ト	D_E Y0 T_AA1 N T
デ タ レ ン ト ギャッ プ	D_IH0 T_E R1 R_AH0 N T G_AE1 P
デ ト ネ ー ショ ン	D_EH2 T_AH0 N_E Y1 SH_AH0 N
デ トッ ク ス	D_I Y1 T_AA2 K S
デ ト リ タ ス	D_IH0 T R_A Y1 T_AH0 S
デュ ー ティ	D_U W1 T_I Y0
デュ ー ティ ー フ リ ー	D_U W1 T_I Y0 F R_I Y1
ジュ ー ス	D_U W1 S
デュ ー ス	D_U W1 S
デュ ー テ リ ウ ム	D_U W0 T_I Y1 R_I Y0 AH0 M
ド イ チュ ラ ン ト	D_O Y1 CH L_AE0 N D
ド イ チュ ラ ン ド	D_O Y1 CH L_AE0 N D
デ バ リュ エ ー ショ ン	D_IH0 V_AE2 LY_U W0 E Y1 SH_AH0 N
ディ ベ ロッ パ ー	D_IH0 V_EH1 L_AH0 P_E R0
デ ベ ロッ パ	D_IH0 V_EH1 L_AH0 P_E R0
デ ベ ロッ パ ー	D_IH0 V_EH1 L_AH0 P_E R0
ディ ベ ラッ プ メ ン ト	D_IH0 V_EH1 L_AH0 P M_AH0 N T
ディ ベ ロッ プ メ ン ト	D_IH0 V_EH1 L_AH0 P M_AH0 N T
デ ベ ロッ プ メ ン ト	D_IH0 V_EH1 L_AH0 P M_AH0 N T
ディ バ イ ス	D_IH0 V_A Y1 S
デ バ イ ス	D_IH0 V_A Y1 S
デ ヴィ ル	D_EH1 V_AH0 L
デ ビ ル	D_EH1 V_AH0 L
デ ヴィ リッ シュ	D_EH1 V L_IH0 SH
デュ ー ベ リ ー	D_U W1 B_EH2 R_I Y0
デ キ ス ト ラ ン	D_EH1 K S T R_AE2 N
デ キ ス ト リ ン	D_EH1 K S T R_IH0 N
ダッ カ	D_AA1 K_AH0
ダ イ ア ク リ ティッ ク	D_A Y2 AH0 K R_IH1 T_AH0 K
ダ イ ア ク リ ティ カ ル マ ー ク	D_A Y2 AH0 K R_IH1 T_AH0 K_AH0 L M_AA1 R K
ダ イ ア ゴ ナ ル	D_A Y0 AE1 G_AH0 N_AH0 L
ダ イ ア グ ラ ム	D_A Y1 AH0 G R_AE2 M
ダ イ ヤ グ ラ ム	D_A Y1 AH0 G R_AE2 M
ダ イ ア ル	D_A Y1 AH0 L
ダ イ ヤ ル	D_A Y1 AH0 L
ダ イ ヤ ル イ ン	D_A Y1 AH0 L IH0 N
ダ イ ル ト ー ン	D_A Y1 AH0 L T_O W1 N
ダ イ ア レ ク ト	D_A Y1 AH0 L_EH2 K T
ダ イ ヤ レ ク ト	D_A Y1 AH0 L_EH2 K T
ダ イ ア ロ ー グ	D_A Y1 AH0 L_AO2 G
ダ イ ア ロ グ	D_A Y1 AH0 L_AO2 G
ディ ア マ ン	D_A Y1 AH0 M_AH0 N T
ダ イ ア ミ タ ー	D_A Y0 AE1 M_AH0 T_E R0
ダ イ ア メ ー タ ー	D_A Y0 AE1 M_AH0 T_E R0
ダ イ ア モ ン ド	D_A Y1 M_AH0 N D
ダ イ ヤ モ ン ド	D_A Y1 M_AH0 N D
ディ ー ア ー ナ	D_A Y0 AE1 N_AH0
ディ ア ー ナ	D_A Y0 AE1 N_AH0
ディ ア ナ	D_A Y0 AE1 N_AH0
ダ イ ア ナ	D_A Y0 AE1 N_AH0
ダ イ ア ネ ティ ク ス	D_A Y2 AH0 N_EH1 T_IH0 K S
ダ イ ア ネ ティッ ク ス	D_A Y2 AH0 N_EH1 T_IH0 K S
ダ イ ア フ ラ ム	D_A Y1 AH0 F R_AE2 M
ダ イ ヤ フ ラ ム	D_A Y1 AH0 F R_AE2 M
ダ イ ア リ ー	D_A Y1 E R0 I Y0
ディ ア ス ポ ラ	D_A Y0 AE1 S P_E R0 AH0
ジ ア ス タ ー ゼ	D_A Y1 AH0 S T_E Y2 S
ダ イ ア ト ニッ ク	D_A Y2 AH0 T_AA1 N_IH0 K
ダ イ ス	D_A Y1 S
ダ イ ク ロ イッ ク ミ ラ ー	D_A Y0 K R_O W1 IH0 K M_IH1 R_E R0
ダ イ シ ン グ	D_A Y1 S_IH0 N G
ディッ キ ー	D_IH1 K_I Y0
ディ ク テ ー ショ ン	D_IH0 K T_E Y1 SH_AH0 N
ディ ク ショ ン	D_IH1 K SH_AH0 N
ディ ク ショ ナ リ	D_IH1 K SH_AH0 N_EH2 R_I Y0
ディ ク ショ ナ リ ー	D_IH1 K SH_AH0 N_EH2 R_I Y0
ダ イ カ ス ト	D_A Y1 K_AE1 S T
ダ イ キャ ス ト	D_A Y1 K_AE1 S T
ジ ー ゼ ル	D_I Y1 S_AH0 L
ディ ー ゼ ル	D_I Y1 S_AH0 L
ダ イ エッ ト	D_A Y1 AH0 T
ディ フ	D_IH1 F
ディ ファ レ ン シ ア ル	D_IH2 F_E R0 EH1 N SH_AH0 L
ディ ファ レ ン シャ ル	D_IH2 F_E R0 EH1 N SH_AH0 L
ディ ファ レ ン シ エ ー ショ ン	D_IH0 F_E R0 EH2 N SH_I Y0 E Y1 SH_AH0 N
ディ フュ ー ジョ ン イ ン デッ ク ス	D_IH0 FY_U W1 ZH_AH0 N IH1 N D_EH0 K S
ダ イ ジェ ス ト	D_A Y0 JH_EH1 S T
ダ イ ジェ ス ト ア ク セ ス プ ロ ト コ ル	D_A Y0 JH_EH1 S T AE1 K S_EH2 S P R_O W1 T_AH0 K_AA2 L
ディ ジッ ト	D_IH1 JH_AH0 T
デ ジッ ト	D_IH1 JH_AH0 T
ディ ジ タ ル	D_IH1 JH_AH0 T_AH0 L
デ ジ	D_IH1 JH_AH0 T_AH0 L
デ ジ タ ル	D_IH1 JH_AH0 T_AH0 L
デ ジ タ ル カ メ ラ	D_IH1 JH_AH0 T_AH0 L K_AE1 M_E R0 AH0
デ ジ タ ル マ ネ ー	D_IH1 JH_AH0 T_AH0 L M_AH1 N_I Y0
デ ジ タ ル パ チ ン コ	D_IH1 JH_AH0 T_AH0 L P_AH0 CH_IH1 N G K_O W0
デ ジ タ ル チ ケッ ト	D_IH1 JH_AH0 T_AH0 L T_IH1 K_AH0 T
ジ ギ タ リ ス	D_IH2 JH_AH0 T_AE1 L_AH0 S
ディ ジ タ ラ イ ズ	D_IH1 JH_AH0 T_A Y2 Z
ディ グ ニ ティ	D_IH1 G N_AH0 T_I Y0
ディ グ ニ ティ ー	D_IH1 G N_AH0 T_I Y0
ディ ル ド	D_IH1 L D_O W2
ジ レ ン マ	D_IH0 L_EH1 M_AH0
ディ レ ン マ	D_IH0 L_EH1 M_AH0
ディ リ ジェ ン ス	D_IH1 L_IH0 JH_AH0 N S
ディ ル	D_IH1 L
ダ イ ム	D_A Y1 M
ダ イ メ ン ショ ン	D_IH0 M_EH1 N SH_AH0 N
ディ メ ン ショ ン	D_IH0 M_EH1 N SH_AH0 N
ディ メ ン ショ ン メ ン バ プ ロ パ ティ	D_IH0 M_EH1 N SH_AH0 N M_EH1 M B_E R0 P R_AA1 P_E R0 T_I Y0
ディ メ ン ショ ナ リ ティ	D_IH0 M_EH2 N SH_AH0 N_AE1 L_AH0 T_I Y0
ディ ミ ニッ シュ	D_IH0 M_IH1 N_IH0 SH
ディ ミ ニッ シ ン グ リ タ ー ン ズ	D_IH0 M_IH1 N_IH0 SH_IH0 N G R_IH0 T_E R1 N Z
ディ ン プ ル	D_IH1 M P_AH0 L
ディ ン	D_IH1 N
ダ イ ナ ー	D_A Y1 N_E R0
ディ ン ギ ー	D_IH1 N G_I Y0
ダ イ ニ ン グ	D_A Y1 N_IH0 N G
ディ ナ ー	D_IH1 N_E R0
ディ ナ ー タ イ ム	D_IH1 N_E R0 T_A Y2 M
ダ イ ノ ソ ー	D_A Y1 N_AH0 S_AO2 R
ダ イ ノ ソ ア	D_A Y1 N_AH0 S_AO2 R
ディ ノ サ ウ ル	D_A Y1 N_AH0 S_AO2 R
ディ ノ サ ウ ル ス	D_A Y1 N_AH0 S_AO2 R Z
ダ イ オ ー ド	D_A Y1 O W2 D
ダ イ オ ド	D_A Y1 O W2 D
ディ オ ン	D_A Y1 AH0 N
ダ イ オ キ シ ン	D_A Y2 AA1 K S_IH0 N
ディッ プ	D_IH1 P
ディ プ ス イッ チ	D_IH1 P S W_IH1 CH
ジ フ テ リ ア	D_IH0 F TH_IH1 R_I Y0 AA0
ジ フ テ リ ヤ	D_IH0 F TH_IH1 R_I Y0 AA0
ジ フ ト リ ア	D_IH0 F TH_IH1 R_I Y0 AA0
ディ プ ロ マ	D_IH0 P L_O W1 M_AA0
ディ プ ロ マ シ ー	D_IH0 P L_O W1 M_AH0 S_I Y0
ディ プ ロ マッ ト	D_IH1 P L_AH0 M_AE2 T
ダ イ ポ ー ル	D_A Y1 P_O W2 L
ダ イ ポ ル	D_A Y1 P_O W2 L
ディッ プ ス	D_IH1 P S
ダ イ レ ク ト	D_E R0 EH1 K T
ダ イ レ ク ト マ ー ケ ティ ン グ	D_E R0 EH1 K T M_AA1 R K_AH0 T_IH0 N G
ダ イ レ ク ショ ン	D_E R0 EH1 K SH_AH0 N
ディ レ ク ショ ン	D_E R0 EH1 K SH_AH0 N
ディ レ ク ティ ブ	D_E R0 EH1 K T_IH0 V
ディ レ ク タ	D_E R0 EH1 K T_E R0
ディ レ ク タ ー	D_E R0 EH1 K T_E R0
ディ レ ク ト リ	D_E R0 EH1 K T_E R0 I Y0
ディ レ ク ト リ ー	D_E R0 EH1 K T_E R0 I Y0
ディ レ ク ト リィ	D_E R0 EH1 K T_E R0 I Y0
ダ ー ト	D_E R1 T
ダ ー ティ	D_E R1 T_I Y0
ダ ー ティ ー	D_E R1 T_I Y0
ダ イ サ	D_IH1 S_AH0
ディ ス エ ー ブ ル	D_IH0 S_E Y1 B_AH0 L
ディ セ ー ブ ル	D_IH0 S_E Y1 B_AH0 L
ディ ス ア ド バ ン テ ー ジ	D_IH2 S_AH0 D V_AE1 N T_IH0 JH
ディ ス ア セ ン ブ ル	D_IH2 S_AH0 S_EH1 M B_AH0 L
ディ ス チャ ー ジ	D_IH0 S CH_AA1 R JH
ディ シ プ リ ン	D_IH1 S_AH0 P L_AH0 N
ディ ス ク ロ ー ジャ ー	D_IH0 S K L_O W1 ZH_E R0
ディ ス コ	D_IH1 S K_O W0
ディ ス コ グ ラ フィ	D_IH0 S K_AO1 G R_AH0 F_I Y0
ディ ス コ グ ラ フィ ー	D_IH0 S K_AO1 G R_AH0 F_I Y0
ディ ス コ ネ ク ト	D_IH0 S K_AH0 N_EH1 K T
ディ ス コ ー ド	D_IH1 S K_AO0 R D
ディ ス コ テ ー ク	D_IH1 S K_O W0 T_EH2 K
ディ ス カ ウ ン ト	D_IH0 S K_A W1 N T
ディ ス カ ウ ン タ ー	D_IH1 S K_A W2 N T_E R0
ディ ス カ レッ ジ	D_IH0 S K_E R1 IH0 JH
ディ ス コ ー ス	D_IH1 S K_AO0 R S
ディ ス カ バ ー	D_IH0 S K_AH1 V_E R0
ディ ス カ バ ラ ー	D_IH0 S K_AH1 V_AH0 R_E R0
ディ ス カ バ リ ー	D_IH0 S K_AH1 V_E R0 I Y0
ディ ス ク レ パ ン シ ー	D_IH0 S K R_EH1 P_AH0 N S_I Y0
ディ ス ク リ ー ト	D_IH0 S K R_I Y1 T
ディ ス ク レ ショ ン	D_IH0 S K R_EH1 SH_AH0 N
ディ ス カ ス	D_IH1 S K_AH0 S
ディ ス カッ ショ ン	D_IH0 S K_AH1 SH_AH0 N
ディ ジ ー ズ	D_IH0 Z_I Y1 Z
ディッ シュ	D_IH1 SH
ディッ シャ ー	D_IH1 SH_E R0
デ サ リュ ー ジョ ン	D_IH2 S_IH0 L_U W1 ZH_AH0 N
デ スィ リュ ー ジョ ン	D_IH2 S_IH0 L_U W1 ZH_AH0 N
ディ ス イ ン フ レ	D_IH2 S_IH0 N F L_E Y1 SH_AH0 N
ディ ス イ ン フ レ ー ショ ン	D_IH2 S_IH0 N F L_E Y1 SH_AH0 N
ディ ス ク	D_IH1 S K
ディ ス ク ド ラ イ ブ	D_IH1 S K D R_A Y1 V
ディ ス ケッ ト	D_IH0 S K_EH1 T
ディ ス ケッ ト ド ラ イ ブ	D_IH0 S K_EH1 T D R_A Y1 V
ディ ス ク レ ス	D_IH1 S K L_AH0 S
ディ ス ラ イ ク	D_IH0 S L_A Y1 K
ディ ズ ニ ー	D_IH1 Z N_I Y0
ディ ズ ニ ー ラ ン ド	D_IH1 Z N_I Y0 L_AE2 N D
ディ ス パッ チ	D_IH0 S P_AE1 CH
ディ ス パッ チャ	D_IH0 S P_AE1 CH_E R0
ディ ス パッ チャ ー	D_IH0 S P_AE1 CH_E R0
ディ ス プ レ ー ス メ ン ト	D_IH0 S P L_E Y1 S M_AH0 N T
ディ ス プ レ ー	D_IH0 S P L_E Y1
ディ ス プ レ イ	D_IH0 S P L_E Y1
ディ ス ポ ー ザ ブ ル	D_IH0 S P_O W1 Z_AH0 B_AH0 L
ディ ス ポ ー ザ ー	D_IH0 S P_O W1 Z_E R0
ディ ス ラ プ ト	D_IH0 S R_AH1 P T
ディ ゾ ル ブ	D_IH0 Z_AA1 L V
ディ ス タ ン ス	D_IH1 S T_AH0 N S
ジ ス テ ン パ ー	D_IH0 S T_EH1 M P_E R0
ディ ス テ ン パ ー	D_IH0 S T_EH1 M P_E R0
ディ ス ト ー ショ ン	D_IH0 S T_AO1 R SH_AH0 N
ディ ス ト リ ビュ ー ショ ン	D_IH2 S T R_AH0 BY_U W1 SH_AH0 N
ディ ス ト リ ビュ ー タ ー	D_IH0 S T R_IH1 BY_AH0 T_E R0
ディ ス ト リ ビュ ー タ ー キャッ プ	D_IH0 S T R_IH1 BY_AH0 T_E R0 K_AE1 P
ディ ス タ ー ブ	D_IH0 S T_E R1 B
ディ ザ	D_IH1 DH_E R0
ディ ザ リ ン グ	D_IH1 DH_E R0 IH0 N G
ディ ー ヴァ	D_I Y1 V_AH0
ディ ー バ	D_I Y1 V_AH0
ダ イ ブ	D_A Y1 V
ダ イ ブ テ ー ブ ル	D_A Y1 V T_E Y1 B_AH0 L
ダ イ バ ー	D_A Y1 V_E R0
ダ イ バ ー シ ティ	D_IH0 V_E R1 S_IH0 T_I Y0
ダ イ バ ー シ ティ ー	D_IH0 V_E R1 S_IH0 T_I Y0
ディ ヴェ ル ティ メ ン ト	D_IH0 V_E R2 T_AH0 M_EH1 N T_O W2
ディ ベ ル ティ メ ン ト	D_IH0 V_E R2 T_AH0 M_EH1 N T_O W2
ディ バ イ ド	D_IH0 V_A Y1 D
ディ バ イ デッ ド ス カ ー ト	D_IH0 V_A Y1 D_IH0 D S K_E R1 T
ディ バ イ ダ	D_IH0 V_A Y1 D_E R0
ディ バ イ ダ ー	D_IH0 V_A Y1 D_E R0
デ バ イ ダ ー	D_IH0 V_A Y1 D_E R0
ダ イ ヴィ ン グ	D_A Y1 V_IH0 N G
ダ イ ビ ン グ	D_A Y1 V_IH0 N G
ダ イ ビ ン グ キャッ チ	D_A Y1 V_IH0 N G K_AE1 CH
ディ ビ ジョ ン	D_IH0 V_IH1 ZH_AH0 N
ディ ボ ー ス	D_IH0 V_AO1 R S
ディ キ シ ー	D_IH1 K S_I Y0
デ キ シ ー	D_IH1 K S_I Y0
ディ キ シ ー ラ ン ド	D_IH1 K S_I Y0 L_AE2 N D
デ キ シ ー ラ ン ド	D_IH1 K S_I Y0 L_AE2 N D
ジ ブ チ	JH_IH0 B_U W1 T_I Y2
ドゥ ー イッ ト ユ ア セ ル フ	D_U W1 IH1 T Y_E R0 S_EH1 L F
ドゥ イッ ト ユ ア セ ル フ	D_U W1 IH1 T Y_E R0 S_EH1 L F
ド ー ベ ル マ ン	D_O W1 B_E R0 M_AH0 N
ダッ ク	D_AA1 K
ドッ ク	D_AA1 K
ドッ キ ン グ	D_AA1 K_IH0 N G
ドッ キ ン グ ス テ ー ショ ン	D_AA1 K_IH0 N G S T_E Y1 SH_AH0 N
ド ク タ ー	D_AA1 K T_E R0
ド ク ト ル	D_AA1 K T_E R0
ド ク ト リ ン	D_AO1 K T_E R0 IH0 N
ド キュ ド ラ マ	D_AA1 KY_U W0 D R_AA2 M_AH0
ド キュ メ ン ト	D_AA1 KY_U W0 M_EH0 N T
ド キュ メ ン トィ ン ド ウ	D_AA1 KY_U W0 M_EH0 N T W_IH1 N D_O W0
ド キュ メ ン タ リ	D_AA2 KY_U W0 M_EH1 N T_E R0 I Y0
ド キュ メ ン タ リ ー	D_AA2 KY_U W0 M_EH1 N T_E R0 I Y0
ド キュ メ ン タ ル	D_AA2 KY_U W0 M_EH1 N T_E R0 I Y0
ド キュ メ ン テ ー ショ ン	D_AA2 KY_U W0 M_EH0 N T_E Y1 SH_AH0 N
ドッ ジ ン グ	D_AA1 JH_IH0 N G
ド ー ド ー	D_O W1 D_O W0
ド ド	D_O W1 D_O W0
ドッ グ	D_AO1 G
ド ー ジェ	D_O W1 JH
ド ギ ー バッ グ	D_AO1 G_I Y0 B_AE1 G
ド グ マ	D_AA1 G M_AH0
ド グ マ チッ ク	D_AA0 G M_AE1 T_IH0 K
ド グ マ ティッ ク	D_AA0 G M_AE1 T_IH0 K
ド グ マ チ ズ ム	D_AA1 G M_AH0 T_IH2 Z_AH0 M
ド グ マ ティ ズ ム	D_AA1 G M_AH0 T_IH2 Z_AH0 M
ド	D_O W1
ド ー ハ	D_O W1 HH_AA2
ド イ モ イ	D_O Y1 M W_AA1
ド イ リ ー	D_O Y1 L_I Y0
ド ク タ ー	D_AA1 K T_E R0
ド ク ト ル	D_AA1 K T_E R0
ド ル チェ	D_O W1 L CH_E Y2
ド ー ル	D_AA1 L
ダ ラ ー	D_AA1 L_E R0
ド ル ラ ル	D_AA1 L_E R0
ド ー ル ハ ウ ス	D_AA1 L HH_A W2 S
ド リ ー	D_AA1 L_I Y0
ド ル マ ン	D_AA1 L M_AH0 N
ド ロ マ イ ト	D_O W1 L_AH0 M_A Y2 T
ド ル フィ ン	D_AA1 L F_AH0 N
ド ム	D_AA1 M
ド メ イ ン	D_O W0 M_E Y1 N
ド ー ム	D_O W1 M
ド メ ス チッ ク	D_AH0 M_EH1 S T_IH0 K
ド メ ス ティッ ク	D_AH0 M_EH1 S T_IH0 K
ド メ ス ティッ ク ブ ラ ン ド	D_AH0 M_EH1 S T_IH0 K B R_AE1 N D
ド ミ ナ	D_O W0 M_I Y1 N_AH0
ド ミ ナ ン ト	D_AA1 M_AH0 N_AH0 N T
ド ミ ネ ー ト	D_AA1 M_AH0 N_E Y2 T
ド ミ ネ イ ト	D_AA1 M_AH0 N_E Y2 T
ド ミ ネ ー ショ ン	D_AA2 M_AH0 N_E Y1 SH_AH0 N
ド ミ ン ゴ	D_O W0 M_IH1 N G G_O W0
ド ミ ニ カ	D_AH0 M_IH1 N_IH0 K_AH0
ド ミ ニ オ ン	D_AH0 M_IH1 NY_AH0 N
ド ミ ノ	D_AA1 M_IH0 N_O W2
ド ン	D_AA1 N
ド ネ ー ショ ン	D_O W0 N_E Y1 SH_AH0 N
ゴ ー ン	D_AO1 N G
ド ン	D_AO1 N G
ド ン キ ー	D_AA1 N G K_I Y0
ド ナ ー	D_O W1 N_E R0
ドゥ ー ワッ プ	D_U W1 W_AA1 P
ドゥ ー ム	D_U W1 M
ド ー ム ズ デ ー	D_U W1 M Z D_E Y2
ド ア	D_AO1 R
ド ア ー	D_AO1 R
ド ア ア イ	D_AO1 R A Y1
ド ア ホ ン	D_AO1 R F_O W1 N
ド ア ツ ー ド ア	D_AO1 R T_U W1 D_AO1 R
ド ア ベ ル	D_AO1 R B_EH2 L
ド ア マッ ト	D_AO1 R M_AE2 T
ド ア ー ズ	D_AO1 R Z
ドゥ ー パ	D_O W1 P_AH0
ド ー パ ミ ン	D_AA1 P_AH0 M_A Y2 N
ド ー プ	D_O W1 P
ドッ プ ラ ー	D_AA1 P L_E R0
ド ラ	D_AO1 R_AH0
ド ラ ー ド	D_AO0 R_AA1 D_O W0
ド ラ ド	D_AO0 R_AA1 D_O W0
ド ー リ ア	D_AO1 R_I Y0 AH0
ド リ ア	D_AO1 R_I Y0 AH0
ド ー マ ー	D_AO1 R M_E R0
ド ー ミ ト リ ー	D_AO1 R M_AH0 T_AO2 R_I Y0
ド ミ ト リ ー	D_AO1 R M_AH0 T_AO2 R_I Y0
ド ー ズ	D_O W1 S
ドッ ト	D_AA1 T
ト ン	D_AA1 T
ドッ ト ボ ム	D_AA1 T B_AA1 M
ドッ ト ドッ ト	D_AA1 T D_AA1 T
ダ ブ ル	D_AH1 B_AH0 L
ダ ブ ル ボ ギ ー	D_AH1 B_AH0 L B_O W1 G_I Y0
ダ ブ ル ブ レ ス ト	D_AH1 B_AH0 L B R_EH1 S T_AH0 D
ダ ブ ル ボ タ ン	D_AH1 B_AH0 L B_AH1 T_AH0 N
ダ ブ ル カ ウ ン ト	D_AH1 B_AH0 L K_A W1 N T
ダ ブ ル デッ カ ー	D_AH1 B_AH0 L D_EH1 K_E R0
ダ ブ ル ハ イ ト	D_AH1 B_AH0 L HH_A Y1 T
ダ ブ ル ニッ ト	D_AH1 B_AH0 L N_IH1 T
ダ ブ ル パ ン チ	D_AH1 B_AH0 L P_AH1 N CH
ダ ブ ル ス タ ン ダ ー ド	D_AH1 B_AH0 L S T_AE1 N D_E R0 D
ダ ブ ル タッ プ	D_AH1 B_AH0 L T_AE1 P
ダ ブ ル ス	D_AH1 B_AH0 L Z
ダ ブ ル ス ピ ー ク	D_AH1 B_AH0 L S P_I Y2 K
ダ ブ リ ン グ	D_AH1 B_AH0 L_IH0 N G
ダ ウ ト	D_A W1 T
ド ウ	D_O W1
ド ー ナ ツ	D_O W1 N_AH2 T
ド ー ナッ ツ	D_O W1 N_AH2 T
ダ ウ	D_A W1
ダ ン	D_A W1 N
ダ ウ ン	D_A W1 N
ダ ウ ン ビ ー ト	D_A W0 N B_I Y1 T
ダ ウ ナ ー	D_A W1 N_E R0
ダ ウ ン ヒ ル	D_A W1 N HH_IH1 L
ダ ウ ン ロ ー ド	D_A W1 N L_O W2 D
ダ ウ ン サ イ ズ	D_A W1 N S_A Y2 Z
ダ ウ ン サ イ ジ ン グ	D_A W1 N S_A Y2 Z_IH0 N G
ダ ウ ン ス ト リ ー ム	D_A W1 N S T R_I Y1 M
ダ ウ ン タ ウ ン	D_A W1 N T_A W1 N
ダ ウ ジ ン グ	D_A W1 S_IH0 N G
ダ ズ ン	D_AH1 Z_AH0 N
ダ ラ ク マ	D R_AE1 K M_AH0
ド ラ ク マ	D R_AE1 K M_AH0
ド ラ ク メ	D R_AE1 K M_AH0
ド ラ フ ト	D R_AE1 F T
ド ラッ ク	D R_AE1 G
ド ラッ グ	D R_AE1 G
ド ラァ グ	D R_AE1 G
ド ラッ ギ ン グ	D R_AE1 G_IH0 N G
ド ラ ゴ ン	D R_AE1 G_AH0 N
ド レ ー ン	D R_E Y1 N
ド レ イ ン	D R_E Y1 N
ド レ ン	D R_E Y1 N
ド レ ナ ー ジ	D R_E Y1 N_AH0 JH
ド レ ナ ー ジュ	D R_E Y1 N_AH0 JH
ダ ラ ム	D R_AE1 M
ド ラ ム	D R_AE1 M
ド ラ マ	D R_AA1 M_AH0
ド ラ マ チッ ク	D R_AH0 M_AE1 T_IH0 K
ド ラ マ ティッ ク	D R_AH0 M_AE1 T_IH0 K
ド ラ マ チ ス ト	D R_AA1 M_AH0 T_IH0 S T
ド レ ー プ	D R_E Y1 P
ド レ ー ピ ン グ	D R_E Y1 P_IH0 N G
ド ラ ス チッ ク	D R_AE1 S T_IH0 K
ド ラ ス ティッ ク	D R_AE1 S T_IH0 K
ド ロ ー	D R_AO1
ド ロ ー ワ ー	D R_AO1 R
ド ロ ア	D R_AO1 R
ド ロ ア ー	D R_AO1 R
ド ロ ワ	D R_AO1 R
ド ロ ワ ー	D R_AO1 R
ズ ロ ー ス	D R_AO1 R Z
ド ロ ワ ー ス	D R_AO1 R Z
ド ロ ワ ー ズ	D R_AO1 R Z
ド ロ ー イ ン グ	D R_AO1 IH0 N G
ド ロ ー ン ゲ ー ム	D R_AO1 N G_E Y1 M
ド ロ ン ゲ ー ム	D R_AO1 N G_E Y1 M
ド レッ ド ノ ー ト	D R_EH1 D N_AO2 T
ド リ ー ム	D R_I Y1 M
ド リ ー ム ボッ ク ス	D R_I Y1 M B_AA1 K S
ド リ ー マ ー	D R_I Y1 M_E R0
ド リ ー ミ ン グ	D R_I Y1 M_IH0 N G
ド リ ー ム ラ ン ド	D R_I Y1 M L_AE2 N D
ド リ ー ミ ー	D R_I Y1 M_I Y0
ド レッ ジ	D R_EH1 JH
ド レ ス	D R_EH1 S
ド レッ サ ー ジュ	D R_EH0 S_AA1 ZH
ド レッ サ ー	D R_EH1 S_E R0
ド レッ シ ン グ	D R_EH1 S_IH0 N G
ド レッ シ ン グ	D R_EH1 S_IH0 N G
ド レ ス メ ー カ ー	D R_EH1 S M_E Y2 K_E R0
ド レ ス メ ー キ ン グ	D R_EH1 S M_E Y2 K_IH0 N G
ド レッ シ ー	D R_EH1 S_I Y0
ド リ ブ ル	D R_IH1 B_AH0 L
ド リ フ ト	D R_IH1 F T
ド リ フ タ ー	D R_IH1 F T_E R0
ド リ ル	D R_IH1 L
