リ ア ラ イ ズ	R_I Y1 AH0 L_A Y2 Z
レ ア ル ポ リ ティ ー ク	R_I Y2 L P_AO2 L_IH0 T_IH1 K
レ ア ル ポ リ ティ ク	R_I Y2 L P_AO2 L_IH0 T_IH1 K
レ ア ル ポ リ ティッ ク	R_I Y2 L P_AO2 L_IH0 T_IH1 K
リ ー ム	R_I Y1 M
リ ー マ ー	R_I Y1 M_E R0
リ ー パ ー	R_I Y1 P_E R0
リ ア	R_IH1 R
リ ヤ	R_IH1 R
リ ヤ サ ス ペ ン ショ ン	R_IH1 R S_AH0 S P_EH1 N SH_AH0 N
リ ー ズ ン	R_I Y1 Z_AH0 N
リ ー ス ナ ブ ル	R_I Y1 Z_AH0 N_AH0 B_AH0 L
リ ー ズ ナ ブ ル	R_I Y1 Z_AH0 N_AH0 B_AH0 L
リ バ ラ ン ス	R_I Y0 B_AE1 L_AH0 N S
リ バ ラ ン シ ン グ	R_I Y0 B_AE1 L_AH0 N S_IH0 N G
リ ベ ー ト	R_I Y1 B_E Y2 T
レ ベ リ オ ン	R_IH0 B_EH1 LY_AH0 N
レ ベ リ ヨ ン	R_IH0 B_EH1 LY_AH0 N
リ ブ ー ト	R_I Y0 B_U W1 T
リ バ ウ ン ド	R_I Y0 B_A W1 N D
リ コ ー ル	R_I Y1 K_AO2 L
レ シ ー ト	R_IH0 S_I Y1 T
レ シ ー バ	R_AH0 S_I Y1 V_E R0
レ シ ー バ ー	R_AH0 S_I Y1 V_E R0
レ シ ー ブ	R_AH0 S_I Y1 V_IH0
リ セ プ ショ ン	R_IH0 S_EH1 P SH_AH0 N
レ セ プ ショ ン	R_IH0 S_EH1 P SH_AH0 N
レ セ プ ショ ン ア テ ン ダ ン ト	R_IH0 S_EH1 P SH_AH0 N AH0 T_EH1 N D_AH0 N T
レ セ プ タ ー	R_I Y0 S_EH1 P T_E R0
リ セッ ショ ン	R_IH0 S_EH1 SH_AH0 N
リ チャ ー ジ	R_I Y0 CH_AA1 R JH
レ シ ピ	R_EH1 S_AH0 P_I Y0
レ シ ピ ー	R_EH1 S_AH0 P_I Y0
レ シ ピ エ ン ト	R_AH0 S_IH1 P_I Y0 AH0 N T
レ シ プ ロ ケ イ ティ ン グ エ ン ジ ン	R_IH0 S_IH1 P R_AH0 K_E Y2 T_IH0 N G EH1 N JH_AH0 N
リ シ プ ロ シ ティ ー	R_EH2 S_IH0 P R_AA1 S_IH0 T_I Y0
レ シ プ ロ シ ティ ー	R_EH2 S_IH0 P R_AA1 S_IH0 T_I Y0
リ サ イ タ ル	R_AH0 S_A Y1 T_AH0 L
レ シ テ ー ショ ン	R_EH2 S_AH0 T_E Y1 SH_AH0 N
レ コ グ ニ ショ ン	R_EH2 K_AH0 G N_IH1 SH_AH0 N
リ コ イ ル	R_I Y0 K_O Y1 L
リ コ メ ン デ ー ショ ン	R_EH2 K_AH0 M_AH0 N D_E Y1 SH_AH0 N
レ コ メ ン デ ー ショ ン	R_EH2 K_AH0 M_AH0 N D_E Y1 SH_AH0 N
リ コ メ ン ド	R_EH2 K_AH0 M_EH1 N D
レ コ メ ン ド	R_EH2 K_AH0 M_EH1 N D
リ コ ン ファ ー ム	R_I Y2 K_AH0 N F_E R1 M
リ コ ン ス ト ラ ク ショ ン	R_I Y2 K_AH0 N S T R_AH1 K SH_AH0 N
レ コ ー ド	R_AH0 K_AO1 R D
リ コ ー ダ	R_IH0 K_AO1 R D_E R0
リ コ ー ダ ー	R_IH0 K_AO1 R D_E R0
レ コ ー ダ	R_IH0 K_AO1 R D_E R0
レ コ ー ダ ー	R_IH0 K_AO1 R D_E R0
レ コ ー ディ ン グ	R_AH0 K_AO1 R D_IH0 N G
リ カ バ ー	R_IH0 K_AH1 V_E R0
リ カ バ リ	R_IH0 K_AH1 V R_I Y0
リ カ バ リ ー	R_IH0 K_AH1 V R_I Y0
リ ク リェ ー ショ ン	R_EH2 K R_I Y0 E Y1 SH_AH0 N
リ ク リ エ ー ショ ン	R_EH2 K R_I Y0 E Y1 SH_AH0 N
レ ク リェ ー ショ ン	R_EH2 K R_I Y0 E Y1 SH_AH0 N
レ ク リ エ ー ショ ン	R_EH2 K R_I Y0 E Y1 SH_AH0 N
レ ク リェ ー ショ ナ ル ダ イ ビ ン グ	R_EH2 K R_I Y0 E Y1 SH_AH0 N_AH0 L D_A Y1 V_IH0 N G
リ ク ル ー ト	R_AH0 K R_U W1 T
リ ク ル ー ト ファッ ショ ン	R_AH0 K R_U W1 T F_AE1 SH_AH0 N
リ ク ル ー ト ス ー ツ	R_AH0 K R_U W1 T S_U W1 T
リ ク ル ー タ ー	R_IH0 K R_U W1 T_E R0
リ カ レ ン ト	R_IH0 K_E R1 AH0 N T
リ カ ー シ ブ	R_I Y2 K_E R1 S_IH0 V
リ サ イ ク リ ン グ	R_I Y0 S_A Y1 K_AH0 L_IH0 N G
リ サ イ ク ル	R_I Y0 S_A Y1 K_AH0 L
レッ ド	R_EH1 D
レ ディッ ト	R_EH1 D_IH0 T
リ ー ダ イ ヤ ル	R_I Y0 D_A Y1 AH0 L
リ ダ イ ア ル	R_I Y0 D_A Y1 AH0 L
リ ダ イ ヤ ル	R_I Y0 D_A Y1 AH0 L
リ ダ イ レ ク ト	R_I Y2 D_E R0 EH1 K T
リ ダ イ レ ク ショ ン	R_I Y2 D_E R0 EH1 K SH_AH0 N
リ ディ ス プ レ イ	R_I Y0 D_IH0 S P L_E Y1
レッ ド ネッ ク	R_EH1 D N_EH2 K
リ ドゥ	R_I Y0 D_U W1
リ ドゥ ー	R_I Y0 D_U W1
リ ド レ ス	R_I Y0 D R_EH1 S
リ デュ ー ス	R_IH0 D_U W1 S
リ ダ ク ショ ン	R_IH0 D_AH1 K SH_AH0 N
レ ダ ク ショ ン ギ ヤ	R_IH0 D_AH1 K SH_AH0 N G_IH1 R
リ ダ ン ダ ン シ ー	R_IH0 D_AH1 N D_AH0 N S_I Y0
リ ー フ	R_I Y1 F
リ ー ファ ー	R_I Y1 F_E R0
リ ー ル	R_I Y1 L
レ フェ リ ー	R_EH2 F_E R0 I Y1
レ フ リ ー	R_EH2 F_E R0 I Y1
リ ファ レ ン ス	R_EH1 F_E R0 AH0 N S
レ ファ レ ン ス	R_EH1 F_E R0 AH0 N S
リ ファ レ ン ダ ム	R_EH2 F_E R0 EH1 N D_AH0 M
レ ファ レ ン ダ ム	R_EH2 F_E R0 EH1 N D_AH0 M
レ フェ ラ ル セ ン タ	R_IH0 F_E R1 AH0 L S_EH1 N T_E R0
リ フィ ル	R_I Y1 F_IH0 L
レ フィ ル	R_I Y1 F_IH0 L
リ ファ イ ナ ン ス	R_I Y2 F_AH0 N_AE1 N S
リ ファ イ ン	R_AH0 F_A Y1 N
リ フ レ ー ショ ン	R_I Y0 F L_E Y1 SH_AH0 N
リ フ レ ク ト	R_AH0 F L_EH1 K T
リ フ レ ク ショ ン	R_AH0 F L_EH1 K SH_AH0 N
リ フ レ ク ティ ブ	R_IH0 F L_EH1 K T_IH0 V
リ フ レ ク タ	R_IH0 F L_EH1 K T_E R0
リ フ レ ク タ ー	R_IH0 F L_EH1 K T_E R0
レ フ レ ク タ	R_IH0 F L_EH1 K T_E R0
レ フ レ ク タ ー	R_IH0 F L_EH1 K T_E R0
リ フ レッ ク ス	R_I Y1 F L_EH0 K S
レ フ レッ ク ス	R_I Y1 F L_EH0 K S
リ フォ ー ム	R_AH0 F_AO1 R M
リ フォ ー ム イ ン ス ト ラ ク タ ー	R_AH0 F_AO1 R M IH2 N S T R_AH1 K T_E R0
リ フォ ー マ ー	R_IH0 F_AO1 R M_E R0
リ フォ ー ミ ン グ	R_IH0 F_AO1 R M_IH0 N G
リ ホ ー ミ ン グ	R_IH0 F_AO1 R M_IH0 N G
リ フォ ー ミ ス ト	R_IH0 F_AO1 R M_IH0 S T
リ フ レ ー ン	R_IH0 F R_E Y1 N
リ フ レ イ ン	R_IH0 F R_E Y1 N
ル フ ラ ン	R_IH0 F R_E Y1 N
リ フ レ シュ	R_IH0 F R_EH1 SH
リ フ レッ シュ	R_IH0 F R_EH1 SH
リ フ レッ シュ メ ン ト	R_AH0 F R_EH1 SH M_AH0 N T
レ フュ ジ ー	R_EH1 FY_U W0 JH_I Y0
レ ガッ タ	R_IH0 G_AA1 T_AH0
リ ー ゼ ン ト	R_I Y1 JH_AH0 N T
レ ゲ エ	R_EH1 G_E Y2
レ ジ ー ム	R_AH0 ZH_I Y1 M
レ ジ メ ン タ ル	R_EH2 JH_AH0 M_EH1 N T_AH0 L
リ ー ジョ ン	R_I Y1 JH_AH0 N
リ ジョ ン	R_I Y1 JH_AH0 N
リ ー ジョ ナ ル	R_I Y1 JH_AH0 N_AH0 L
レ ジ ス タ	R_EH1 JH_IH0 S T_E R0
レ ジ ス タ ー	R_EH1 JH_IH0 S T_E R0
レ ジ ス タ マ ー ク	R_EH1 JH_IH0 S T_E R0 M_AA1 R K
レ ジ ス タ ー マ ー ク	R_EH1 JH_IH0 S T_E R0 M_AA1 R K
レ ジ ス ト レ ー ショ ン	R_EH2 JH_IH0 S T R_E Y1 SH_AH0 N
レ ジ ス ト リ	R_EH1 JH_IH0 S T R_I Y0
レ ジ ス ト リ ー	R_EH1 JH_IH0 S T R_I Y0
リ グ レッ ショ ン	R_AH0 G R_EH1 SH_AH0 N
リ グ レッ ト	R_AH0 G R_EH1 T
レ ギュ ラ ー	R_EH1 GY_AH0 L_E R0
レ ギュ ラ シ オ ン	R_EH2 GY_AH0 L_E Y1 SH_AH0 N
レ ギュ レ ー ショ ン	R_EH2 GY_AH0 L_E Y1 SH_AH0 N
レ ギュ レ ー タ ー	R_EH1 GY_AH0 L_E Y2 T_E R0
リ ハ ビ リ テ ー ショ ン	R_I Y2 HH_AH0 B_IH2 L_AH0 T_E Y1 SH_AH0 N
リ ハ ー サ ル	R_IH0 HH_E R1 S_AH0 L
レ イ キ	R_E Y1 K_I Y0
リ イ ン バ ー ス メ ン ト	R_I Y2 IH0 M B_E R1 S M_AH0 N T
リ イ ン フォ ー ス メ ン ト	R_I Y2 IH0 N F_AO1 R S M_AH0 N T
リ イ ン ホ ー ス メ ン ト	R_I Y2 IH0 N F_AO1 R S M_AH0 N T
リ ン ホ ー ス	R_I Y2 IH0 N F_AO1 R S
リ ジェ ク ト	R_IH0 JH_EH1 K T
リ レ ー ショ ン	R_I Y0 L_E Y1 SH_AH0 N
リ レ ー ショ ナ ル	R_I Y0 L_E Y1 SH_AH0 N_AH0 L
リ ラッ ク ス	R_IH0 L_AE1 K S
リ ラ ク セ ー ショ ン	R_I Y2 L_AE0 K S_E Y1 SH_AH0 N
リ ラ ク ゼ ー ショ ン	R_I Y2 L_AE0 K S_E Y1 SH_AH0 N
リ レ ー	R_I Y1 L_E Y2
リ リ ー ス	R_I Y0 L_I Y1 S
レ リ ー ズ	R_I Y0 L_I Y1 S
リ リ ー ス イ ベ ン ト	R_I Y0 L_I Y1 S IH0 V_EH1 N T
リ ラ イ ア ビ リ ティ ー	R_I Y0 L_A Y2 AH0 B_IH1 L_AH0 T_I Y0
レ リッ ク	R_EH1 L_IH0 K
リ リ ー フ	R_IH0 L_I Y1 F
レ リ ー フ	R_IH0 L_I Y1 F
リ ロ ー ド	R_I Y0 L_O W1 D
リ ロ ー ド ボ タ ン	R_I Y0 L_O W1 D B_AH1 T_AH0 N
リ ロ ケ ー ト	R_I Y2 L_O W1 K_E Y0 T
リ ロ ケ ー ショ ン	R_I Y2 L_O W1 K_E Y1 SH_AH0 N
リ ロ ケ ー ショ ン サ ー ブ ス	R_I Y2 L_O W1 K_E Y1 SH_AH0 N S_E R1 V_AH0 S
リ ラ ク タ ン ス	R_IH0 L_AH1 K T_AH0 N S
リ メ ー ク	R_I Y1 M_E Y1 K
リ メ イ ク	R_I Y1 M_E Y1 K
リ マ ー ク	R_IH0 M_AA1 R K
リ マ イ ン ダ	R_I Y0 M_A Y1 N D_E R0
リ マ イ ン ダ ー	R_I Y0 M_A Y1 N D_E R0
リ マ イ ン ド	R_I Y0 M_A Y1 N D
レ ミ ニ セ ン ス	R_EH2 M_AH0 N_IH1 S_AH0 N S
リ モ ー ト	R_IH0 M_O W1 T
リ モ ー ト コ ン ト ロ ー ル	R_IH0 M_O W1 T K_AH0 N T R_O W1 L
リ モ ー ト セ ン シ ン グ	R_IH0 M_O W1 T S_EH1 N S_IH0 N G
リ ム ー バ ブ ル	R_IH0 M_U W1 V_AH0 B_AH0 L
リ ム ー バ ー	R_IH0 M_U W1 V_E R0
リ ム ー ブ	R_I Y0 M_U W1 V
ル ネ サ ン ス	R_EH2 N_AH0 S_AA1 N S
ル ネッ サ ー ン ス	R_EH2 N_AH0 S_AA1 N S
ル ネッ サ ン ス	R_EH2 N_AH0 S_AA1 N S
リ ネ ー ム	R_I Y0 N_E Y1 M
レ ン ダ リ ン グ	R_EH1 N D_E R0 IH0 N G
リ ニュ ー ア ブ ル	R_I Y0 N_U W1 AH0 B_AH0 L
リ ニュ ー	R_IH0 N_U W1
レ ニ ン	R_I Y1 N_AH0 N
レ ン ネッ ト	R_EH1 N_AH0 T
リ ニュ ー ア ル	R_IH0 N_U W1 AH0 L
リ ニュ ア ル	R_IH0 N_U W1 AH0 L
リ ノ ヴェ ー ショ ン	R_EH2 N_AH0 V_E Y1 SH_AH0 N
リ ノ ベ ー ショ ン	R_EH2 N_AH0 V_E Y1 SH_AH0 N
レ ノ ヴェ ー ショ ン	R_EH2 N_AH0 V_E Y1 SH_AH0 N
レ ノ ベ ー ショ ン	R_EH2 N_AH0 V_E Y1 SH_AH0 N
レ ン タ ル	R_EH1 N T_AH0 L
ラ ン チ エ	R_EH1 T_I Y2 E R0
レ ピ ー ト	R_IH0 P_I Y1 T
リ ピ ー タ	R_IH0 P_I Y1 T_E R0
リ ピ ー タ ー	R_IH0 P_I Y1 T_E R0
リ ピ ー ト	R_IH0 P_I Y1 T
リ プ レ ー ス	R_I Y2 P L_E Y1 S
リ プ レ ー	R_I Y0 P L_E Y1
リ プ レ イ	R_I Y0 P L_E Y1
レ プ リ カ	R_EH1 P L_IH0 K_AH0
レ プ リ カ セッ ト ト ポ ロ ジ	R_EH1 P L_IH0 K_AH0 S_EH1 T T_AH0 P_AO1 L_AH0 JH_I Y0
リ プ リ ケ ー ト	R_EH1 P L_IH0 K_E Y2 T
リ プ リ ケ ー ショ ン	R_EH2 P L_IH0 K_E Y1 SH_AH0 N
レ プ リ ケ ー ショ ン	R_EH2 P L_IH0 K_E Y1 SH_AH0 N
リ プ ラ イ	R_IH0 P L_A Y1
リ ポ ー ト	R_I Y0 P_AO1 R T
レ ポ ー ト	R_I Y0 P_AO1 R T
ル ポ ル タ ー ジュ	R_IH0 P_AO1 R T_IH0 JH
リ ポ ー タ ー	R_IH0 P_AO1 R T_E R0
レ ポ ー タ ー	R_IH0 P_AO1 R T_E R0
リ ポ ジ ト リ	R_I Y0 P_AA1 Z_AH0 T_AO2 R_I Y0
リ ポ ジ ト リ ー	R_I Y0 P_AA1 Z_AH0 T_AO2 R_I Y0
レ ポ ジ ト リ	R_I Y0 P_AA1 Z_AH0 T_AO2 R_I Y0
レ ポ ジ ト リ ー	R_I Y0 P_AA1 Z_AH0 T_AO2 R_I Y0
リ プ レ ゼ ン テ ー ショ ン	R_EH2 P R_AH0 Z_EH0 N T_E Y1 SH_AH0 N
リ プ レ ゼ ン タ ティ ブ	R_EH2 P R_AH0 Z_EH1 N T_AH0 T_IH0 V
レ プ レ ゼ ン タ ティ ブ	R_EH2 P R_AH0 Z_EH1 N T_AH0 T_IH0 V
リ プ レッ ショ ン	R_I Y0 P R_EH1 SH_AH0 N
リ プ リ ン ト	R_I Y0 P R_IH1 N T
リ プ ロ タ ク ショ ン	R_I Y2 P R_AH0 D_AH1 K SH_AH0 N
リ プ ロ ダ ク ショ ン	R_I Y2 P R_AH0 D_AH1 K SH_AH0 N
リ プ ロ ダ ク ティ ブ ラ イ ツ	R_I Y2 P R_AH0 D_AH1 K T_IH0 V R_A Y1 T S
リ パ ブ リッ ク	R_I Y0 P_AH1 B L_AH0 K
リ パ ブ リ カ ン	R_IH0 P_AH1 B L_IH0 K_AH0 N
レ ピュ テ ー ショ ン	R_EH2 PY_AH0 T_E Y1 SH_AH0 N
レ ピュ テ イ ショ ン	R_EH2 PY_AH0 T_E Y1 SH_AH0 N
リ ク エ ス ト	R_IH0 K W_EH1 S T
レ ク イ エ ム	R_EH1 K W_I Y0 AH0 M
リ ル ー ト	R_I Y0 R_U W1 T
リ セ ー ル	R_I Y1 S_E Y2 L
リ ス ケ ジュ ー ル	R_I Y0 S K_EH1 JH_U W0 L
リ ス ケ ジュ ー リ ン グ	R_I Y0 S K_EH1 JH_U W0 L_IH0 N G
レ ス キュ ー	R_EH1 S KY_U W0
リ サ ー チ	R_I Y0 S_E R1 CH
リ セ ラ ー	R_I Y0 S_EH1 L_E R0
リ ザ ベ ー ショ ン	R_EH2 Z_E R0 V_E Y1 SH_AH0 N
リ ザ ー ブ	R_IH0 Z_E R1 V
レ ザ ー ブ	R_IH0 Z_E R1 V
リ セッ ト	R_I Y0 S_EH1 T
レ ジ デ ン ス	R_EH1 Z_IH0 D_AH0 N S
レ ジ デ ン ト	R_EH1 Z_IH0 D_AH0 N T
レ ジ デ ン シャ ル	R_EH2 Z_IH0 D_EH1 N SH_AH0 L
レ ジ リ エ ン ス	R_IH0 Z_IH1 L_I Y0 AH0 N S
レ ジ ン	R_EH1 Z_AH0 N
レ ジ ス ト	R_IH0 Z_IH1 S T
レ ジ ス タ ン ス	R_IH0 Z_IH1 S T_AH0 N S
レ ゾ リュ ー ショ ン	R_EH2 Z_AH0 L_U W1 SH_AH0 N
レ ゾ ナ ン ス	R_EH1 Z_AH0 N_AH0 N S
リ ゾ ー ト	R_IH0 Z_AO1 R T
リ ゾ ー ト マ ン ショ ン	R_IH0 Z_AO1 R T M_AE1 N SH_AH0 N
リ ソ ー ス	R_I Y1 S_AO0 R S
レ ス ピ レ ー タ ー	R_EH1 S P_E R0 E Y2 T_E R0
レ ス ポ ン ダ	R_IH0 S P_AA1 N D_E R0
リ ス ポ ン ス	R_IH0 S P_AA1 N S
レ ス ポ ン ス	R_IH0 S P_AA1 N S
レ ス ポ ン シ ビ リ ティ ー	R_I Y0 S P_AA2 N S_AH0 B_IH1 L_AH0 T_I Y0
リ ス ポ ン シ ブ	R_IH0 S P_AA1 N S_IH0 V
レ ス ポ ン シ ブ	R_IH0 S P_AA1 N S_IH0 V
レ ス ト	R_EH1 S T
リ ス タ ー ト	R_I Y0 S T_AA1 R T
レ ス ト ラ ン	R_EH1 S T_E R0 AA2 N T
レ ス ト ラ ン ト	R_EH1 S T_E R0 AA2 N T
リ ス トッ キ ン グ フィ ー	R_I Y0 S T_AA1 K_IH0 N G F_I Y1
レ ス ト レ ー ショ ン	R_EH2 S T_E R0 E Y1 SH_AH0 N
リ ス ト ラ ク チャ リ ン グ	R_I Y0 S T R_AH1 K CH_E R0 IH0 N G
リ ス ト ラ ク チュ ア リ ン グ	R_I Y0 S T R_AH1 K CH_E R0 IH0 N G
リ ス ト ラ チャ リ ン グ	R_I Y0 S T R_AH1 K CH_E R0 IH0 N G
リ ザ ル ト	R_IH0 Z_AH1 L T
レ ジ メ	R_IH0 Z_U W1 M
レ ジュ ー ム	R_IH0 Z_U W1 M
レ ジュ メ	R_IH0 Z_U W1 M
リ ザ レ ク ショ ン	R_EH2 Z_E R0 EH1 K SH_AH0 N
レ ス ベ ラ ト ロ ー ル	R_EH0 S V_E R1 AH0 T R_AO0 L
レ ス ベ ラ ト ロ ル	R_EH0 S V_E R1 AH0 T R_AO0 L
リ テ ー ル	R_I Y1 T_E Y2 L
リ テ ー ラ ー	R_I Y1 T_E Y2 L_E R0
リ テ ー ナ ー	R_IH0 T_E Y1 N_E R0
リ テ ナ ー	R_IH0 T_E Y1 N_E R0
リ テ ー ク	R_I Y1 T_E Y1 K
リ テ イ ク	R_I Y1 T_E Y1 K
リ テ ン ショ ン	R_I Y0 T_EH1 N SH_AH0 N
レ チ ナ ー ル	R_EH1 T_AH0 N_AH0 L
レ チ ノ ー ル	R_EH1 T_IH0 N_AO2 L
リ タ イ ア	R_I Y0 T_A Y1 E R0
リ タ イ ヤ	R_I Y0 T_A Y1 E R0
レ ト ル ト	R_I Y1 T_AO2 R T
リ ト ラ ク ト	R_I Y0 T R_AE1 K T
リ ト ラ ク タ ブ ル	R_I Y0 T R_AE1 K T_AH0 B_AH0 L
リ ト リ ー バ ー	R_I Y0 T R_I Y1 V_E R0
リ ト リ バ ー	R_I Y0 T R_I Y1 V_E R0
レ ト リ ー バ	R_I Y0 T R_I Y1 V_E R0
レ ト リ ー バ ー	R_I Y0 T R_I Y1 V_E R0
レ ト リ バ ー	R_I Y0 T R_I Y1 V_E R0
レ ト ロ	R_EH1 T R_O W0
レ ト ロ ゲ ー ム	R_EH1 T R_O W0 G_E Y1 M
レ ト ロ ウ イ ル ス	R_EH2 T R_O W0 V_A Y1 R_AH0 S
リ ト ラ イ	R_I Y0 T R_A Y1
リ タ ー ン	R_IH0 T_E R1 N
リ ー タ ー ン エ ー ス	R_IH0 T_E R1 N E Y1 S
リ タ ー ナ ブ ル	R_I Y0 T_E R1 N_AH0 B_AH0 L
リ タ ー ン ズ	R_IH0 T_E R1 N Z
レ ユ ニ オ ン	R_I Y0 U W1 NY_AH0 N
レ ユ ニ オ ン エ ン ジェ ル フィッ シュ	R_I Y0 U W1 NY_AH0 N E Y1 N JH_AH0 L F_IH2 SH
リ ユ ー ス	R_I Y0 Y_U W1 S
リ バ リュ エ ー ショ ン	R_I Y0 V_AE1 LY_U W0 E Y1 SH_AH0 N
レ ベ レ ー ショ ン	R_EH2 V_AH0 L_E Y1 SH_AH0 N
リ ヴェ ン ジ	R_I Y0 V_EH1 N JH
リ ベ ン ジ	R_I Y0 V_EH1 N JH
レ ベ ニュ ー	R_EH1 V_AH0 N_U W2
レ ベ ニュ ー ニュ ー ト ラ ル	R_EH1 V_AH0 N_U W2 N_U W1 T R_AH0 L
リ ヴァ ー ブ	R_I Y0 V_E R1 B
リ バ ー ブ	R_I Y0 V_E R1 B
リ バ ー サ ル	R_IH0 V_E R1 S_AH0 L
リ バ ー ス	R_IH0 V_E R1 S
レ バ ー ス	R_IH0 V_E R1 S
リ バ ー シ ブ ル	R_IH0 V_E R1 S_AH0 B_AH0 L
レ ヴュ ー	R_I Y2 VY_U W1
レ ビュ ー	R_I Y2 VY_U W1
レ ビュ ー ア ー	R_I Y0 VY_U W1 E R0
レ ビュ ー ワ ー	R_I Y0 VY_U W1 E R0
レ ビュ ア ー	R_I Y0 VY_U W1 E R0
リ バ イ ズ ド エ ディ ショ ン	R_IH0 V_A Y1 Z D AH0 D_IH1 SH_AH0 N
リ ビ ジョ ン	R_I Y0 V_IH1 ZH_AH0 N
リ ビ ジョ ニ ス ト	R_I Y0 V_IH1 ZH_AH0 N_IH0 S T
リ ヴァ イ ヴァ ル	R_IH0 V_A Y1 V_AH0 L
リ バ イ バ ル	R_IH0 V_A Y1 V_AH0 L
リ ボ ー ク	R_I Y0 V_O W1 K
レ ボ ル ト	R_IH0 V_O W1 L T
レ ボ リュ ー ショ ン	R_EH2 V_AH0 L_U W1 SH_AH0 N
リ ボ ル バ ー	R_IH0 V_AA1 L V_E R0
レ ボ ル バ ー	R_IH0 V_AA1 L V_E R0
リ ボ ル ビ ン グ	R_I Y0 V_AA1 L V_IH0 N G
レ ヴュ ー	R_IH0 VY_U W1
レ ビュ ー	R_IH0 VY_U W1
リ ウォ ー ド	R_IH0 W_AO1 R D
リ ワ ー ド	R_IH0 W_AO1 R D
リ ワ イ ン ド	R_I Y1 W_A Y0 N D
リ ラ イ ト	R_I Y0 R_A Y1 T
レ イ キャ ヴィ ー ク	R_EH1 KY_AH0 V_IH0 K
レ イ キャ ヴィ ク	R_EH1 KY_AH0 V_IH0 K
レ イ キャ ビ ー ク	R_EH1 KY_AH0 V_IH0 K
レ イ キャ ビ ク	R_EH1 KY_AH0 V_IH0 K
ラ プ ソ ディ ー	R_AE1 P S_AH0 D_I Y0
レ オ ロ ジ ー	R_I Y0 AO1 L_AH0 JH_I Y0
リ ー サ ス	R_I Y1 S_AH0 S
レ ト リッ ク	R_EH1 T_E R0 IH0 K
ラ イ ン ス ト ー ン	R_A Y1 N S T_O W2 N
ロ ー デ シ ア	R_O W0 D_I Y1 ZH_AH0
ロ ジ ウ ム	R_O W1 D_I Y0 AH0 M
ロ ー ド デ ン ド ロ ン	R_O W2 D_AH0 D_EH1 N D R_AH0 N
ロ ド プ シ ン	R_O W0 D_AA1 P S_AH0 N
ル バ ー ブ	R_U W1 B_AA2 R B
ラ イ ム	R_A Y1 M
リ ズ ム	R_IH1 DH_AH0 M
ル ズ ム	R_IH1 DH_AH0 M
リ ズ ミッ ク	R_IH1 DH M_IH0 K
リ ア ー ル	R_A Y1 AH0 L
リ ブ	R_IH1 B
リ ボ ン	R_IH1 B_AH0 N
ラ イ ス	R_A Y1 S
リッ チ	R_IH1 CH
リッ チ モ ン ド	R_IH1 CH M_AH0 N D
ラ イ ド	R_A Y1 D
ラ イ ダ ー	R_A Y1 D_E R0
リッ ジ	R_IH1 JH
ラ イ ディ ン グ	R_A Y1 D_IH0 N G
リ エ ル	R_I Y1 L
リ ー ス リ ン グ	R_I Y1 Z L_IH0 N G
リ フ	R_IH1 F
ラ イ フ ル	R_A Y1 F_AH0 L
リ グ	R_IH1 G
リ ガ	R_I Y1 G_AH0
リ ガ ト ー ニ	R_IH0 G_AH0 T_O W1 N_I Y0
リ ゲ ル	R_A Y1 JH_AH0 L
リ ギ ン	R_IH1 G_IH0 N G
リ ギ ン グ	R_IH1 G_IH0 N G
ラ イ ト ハ ン ド	R_A Y1 T HH_AE1 N D
リ ム	R_IH1 M
リ ム ク ラッ チ	R_IH1 M K L_AH1 CH
リ ム ショッ ト	R_IH1 M SH_AA1 T
リ ン	R_IH1 N G
リ ン グ	R_IH1 N G
リ ン ギッ ト	R_IH1 N G_IH0 T
リ ン ギ ン グ	R_IH1 N G_IH0 N G
リ ン グ サ イ ド	R_IH1 N G S_A Y2 D
リ ン ス	R_IH1 N S
ラ イ オッ ト	R_A Y1 AH0 T
リッ パ	R_IH1 P_E R0
リッ パ ー	R_IH1 P_E R0
リッ ピ ン グ	R_IH1 P_IH0 N G
リッ プ ル	R_IH1 P_AH0 L
リ プ ル	R_IH1 P_AH0 L
リ ス ク	R_IH1 S K
リ ス キ ー	R_IH1 S K_I Y0
リ ゾッ ト	R_I Y2 S_AO1 T_O W2
リ ス	R_IH1 S
リ タ リ ン	R_IH1 T_AH0 L_IH0 N
ラ イ ヴァ ル	R_A Y1 V_AH0 L
ラ イ バ ル	R_A Y1 V_AH0 L
リ バ ー サ イ ド	R_IH1 V_E R0 S_A Y2 D
リ ベッ ト	R_IH1 V_AH0 T
リ ベッ テッ ド ジョ イ ン ト	R_IH1 V_AH0 T_IH0 D JH_O Y1 N T
リ ヤ ド	R_I Y0 AE1 D
ロ ー ド	R_O W1 D
ロ ー ド ショ ー	R_O W1 D SH_O W2
ロ ー ド ショ ウ	R_O W1 D SH_O W2
ロ ー ド サ イ ド	R_O W1 D S_A Y2 D
ロ ー ド ス タ ー	R_O W1 D S T_E R0
ロ ー ミ ン グ	R_O W1 M_IH0 N G
ロ ー ス ト	R_O W1 S T
ロ ー ス タ ー	R_O W1 S T_E R0
ロ バ	R_AA1 B_E R0
ロ ー ブ	R_O W1 B
ロ ビ ン	R_AA1 B_AH0 N
ロ ボッ ト ア ド バ イ ザ ー	R_O W1 B_O W0 AE0 D V_A Y1 Z_E R0
ロ ボッ ト	R_O W1 B_AA2 T
ロ ボ ティ ク ス	R_O W2 B_AA1 T_IH0 K S
ロ ボ ティッ ク ス	R_O W2 B_AA1 T_IH0 K S
ロ バ ス ト ネ ス	R_O W0 B_AH1 S T N_AH0 S
ロッ ク	R_AA1 K
ロ チェ ス タ ー	R_AA1 CH_EH2 S T_E R0
ロッ ク	R_AA1 K
ロッ ク ク ラ イ ミ ン グ	R_AA1 K K L_A Y1 M_IH0 N G
ロ カ ビ リ ー	R_AA1 K_AH0 B_IH2 L_I Y0
ロ ケッ ト	R_AA1 K_AH0 T
ロ ケッ ト ラ ン チャ ー	R_AA1 K_AH0 T L_AO1 N CH_E R0
ロッ キ ン グ	R_AA1 K_IH0 N G
ロ コ コ	R_AH0 K_O W1 K_O W2
ロッ ド	R_AA1 D
ロ デ オ	R_O W1 D_I Y0 O W2
レ ン ト ゲ ン	R_EH1 N T G_EH2 N
ラ ジャ	R_AA1 JH_E R0
ラ ジャ ー	R_AA1 JH_E R0
ロ ー ル プ レ ー イ ン グ	R_O W1 L P L_E Y1 IH0 N G
ロ ー ル プ レ イ ン グ	R_O W1 L P L_E Y1 IH0 N G
ロ ー ル	R_O W1 L
ロ ー ル アッ プ	R_O W1 L AH1 P
ロ ー ラ ー	R_O W1 L_E R0
ロ ー ラ ー コ ー ス タ ー	R_O W1 L_E R0 K_O W1 S T_E R0
ロ ー リ ン グ	R_O W1 L_IH0 N G
ロ ー リ ン グ ミ ル	R_O W1 L_IH0 N G M_IH1 L
ロ ー ル オ ー バ ー	R_O W1 L_O W2 V_E R0
ロ ム	R_AA1 M
ロ マ	R_O W1 M_AA0
ロ ー マ ン	R_O W1 M_AH0 N
ロ マ ン	R_O W1 M_AH0 N
ロ ー マ ン ス	R_O W0 M_AE1 N S
ロ マ ン ス	R_O W0 M_AE1 N S
ロ マ ネ ス ク	R_O W2 M_AH0 N_EH1 S K
ロ マ ニ	R_O W0 M_AA1 N_I Y0
ロ マ ニ ー	R_O W0 M_AA1 N_I Y0
ロ マ ン チッ ク	R_O W0 M_AE1 N T_IH0 K
ロ マ ン チ ツ ク	R_O W0 M_AE1 N T_IH0 K
ロ マ ン ティッ ク	R_O W0 M_AE1 N T_IH0 K
ロ マ ン チ シ ズ ム	R_O W0 M_AE1 N T_AH0 S_IH2 Z_AH0 M
ロ マ ン ティ シ ズ ム	R_O W0 M_AE1 N T_AH0 S_IH2 Z_AH0 M
ル ー ド	R_U W1 D
ル ー フ	R_U W1 F
ル ー フィ ン グ	R_U W1 F_IH0 N G
ル ー ク	R_UH1 K
ル ー キ ー	R_UH1 K_I Y0
ル ー ム	R_U W1 M
ル ー ム サ ー ビ ス	R_U W1 M S_E R1 V_AH0 S
ル ー ミ ン グ	R_U W1 M_IH0 N G
ル ー ム メ ー ト	R_U W1 M_E Y2 T
ル ー ム メ イ ト	R_U W1 M_E Y2 T
ロ ス ト ル	R_U W1 S T_E R0
ル ー ト	R_U W1 T
ル ー ツ	R_U W1 T S
ロ ー プ	R_O W1 P
ロッ プ	R_O W1 P
ロ ザ リ オ	R_O W0 Z_AA1 R_I Y0 O W0
ロ ー ズ	R_O W1 Z
ロ ー ズ マ ダ ー	R_O W1 Z M_AE1 D_E R0
ロ ー ズ マ リ ー	R_O W1 Z M_EH2 R_I Y0
ロ ー ゼッ ト	R_AH0 S_EH1 T
ロ ゼッ ト	R_AH0 S_EH1 T
ロ ー ズ ウッ ド	R_O W1 Z W_UH2 D
ロ ー ジ ン	R_AA1 Z_AH0 N
ロ ジ ン	R_AA1 Z_AH0 N
ロッ シ ー ニ	R_O W0 S_I Y1 N_I Y0
ロッ ソ	R_O W1 S_O W0
ラ ス タ	R_AA1 S T_E R0
ラ ス タ ー	R_AA1 S T_E R0
ロ ス タ ー	R_AA1 S T_E R0
ロ ー タ リ ー	R_O W1 T_E R0 I Y0
ロ ー テ ー ショ ン	R_O W0 T_E Y1 SH_AH0 N
ロ ー ティ ー	R_O W1 T_I Y0
ロ ティ	R_O W1 T_I Y0
ロ ー タ ー	R_O W1 T_E R0
ロ ー タ ン ダ	R_O W0 T_AH1 N D_AH0
ロ ウ タ ン ダ	R_O W0 T_AH1 N D_AH0
ロ タ ン ダ	R_O W0 T_AH1 N D_AH0
ロ ト ン ダ	R_O W0 T_AH1 N D_AH0
ル ー ジュ	R_U W1 ZH
ラ フ	R_AH1 F
ル ー レッ ト	R_U W0 L_EH1 T
ル レッ ト	R_U W0 L_EH1 T
ラ ウ ン ド	R_A W1 N D
ラ ウ ン ド ア バ ウ ト	R_A W1 N D_AH0 B_A W2 T
ラ ウ ン ダ ー	R_A W1 N D_E R0
ラ ウ ン ド アッ プ	R_A W1 N D_AH2 P
ル ー ト	R_U W1 T
ラ ウ タ ー	R_U W1 T_E R0
ル ー タ	R_U W1 T_E R0
ル ー タ ー	R_U W1 T_E R0
ル ー チ ン	R_U W0 T_I Y1 N
ル ー ティ ー ン	R_U W0 T_I Y1 N
ル ー ティ ン	R_U W0 T_I Y1 N
ル ー チ ン グ	R_A W1 T_IH0 N G
ル ー ティ ン グ	R_A W1 T_IH0 N G
ル ー	R_U W1
ル ウ	R_U W1
ロ ー	R_O W1
ロ ー イ ン グ	R_O W1 IH0 N G
ロ ー ヤ ル	R_O Y0 AE1 L
ロ イ ヤ ル	R_O Y0 AE1 L
ロ ワ イ ヤ ル	R_O Y0 AE1 L
ロ ー ヤ リ ティ	R_O Y1 AH0 L T_I Y0
ロ ー ヤ リ ティ ー	R_O Y1 AH0 L T_I Y0
ロ ー ヤ ル ティ ー	R_O Y1 AH0 L T_I Y0
ロ イ ア リ ティ	R_O Y1 AH0 L T_I Y0
ロ イ ア リ ティ ー	R_O Y1 AH0 L T_I Y0
ロ イ ア ル ティ	R_O Y1 AH0 L T_I Y0
ロ イ ア ル ティ ー	R_O Y1 AH0 L T_I Y0
ロ イ ヤ リ ティ	R_O Y1 AH0 L T_I Y0
ロ イ ヤ リ ティ ー	R_O Y1 AH0 L T_I Y0
ロ イ ヤ ル ティ	R_O Y1 AH0 L T_I Y0
ロ イ ヤ ル ティ ー	R_O Y1 AH0 L T_I Y0
ロ ヤ リ ティ ー	R_O Y1 AH0 L T_I Y0
ロ イ ヤ リ ティ ー フ リ ー	R_O Y1 AH0 L T_I Y0 F R_I Y1
ロ イ ヤ リ ティ フ リ ー	R_O Y1 AH0 L T_I Y0 F R_I Y1
ロ イ ヤ ル ティ ー フ リ ー	R_O Y1 AH0 L T_I Y0 F R_I Y1
ロ イ ヤ ル ティ フ リ ー	R_O Y1 AH0 L T_I Y0 F R_I Y1
ラ バ ー バ ン ディ ン グ	R_AH1 B_E R0 B_AE1 N D_IH0 N G
ル ー ビッ ク キュ ー ブ	R_U W1 B_IH0 K S KY_U W1 B
ル ビ	R_U W1 B_I Y0
ル ビ ー	R_U W1 B_I Y0
リュッ ク サッ ク	R_AH1 K S_AE2 K
リュッ ク ザッ ク	R_AH1 K S_AE2 K
ルッ ク サッ ク	R_AH1 K S_AE2 K
ルッ ク ザッ ク	R_AH1 K S_AE2 K
ラッ ド	R_AH1 D
ラ ダ ー	R_AH1 D_E R0
ル ー ド	R_U W1 D
ラ フ	R_AH1 F
ラッ フ ル	R_AH1 F_AH0 L
ラ グ	R_AH1 G
ラッ グ	R_AH1 G
ラ グ ビ ー	R_AH1 G B_I Y0
ラ ギッ ド	R_AH1 G_IH0 D
ラ ゲッ ド ファ ブ リッ ク	R_AH1 G_IH0 D F_AE1 B R_IH0 K
ル イ ン	R_U W1 AH0 N
ル ー ル	R_U W1 L
ル ー ラ	R_U W1 L_E R0
ル ー ラ ー	R_U W1 L_E R0
ラ ム	R_AH1 M
ラ ム	R_AH1 M P
ラ ン プ	R_AH1 M P
ラ ン	R_AH1 N
ラ ン ス ル	R_AH1 N TH R_U W1
ラ ン ス ル ー	R_AH1 N TH R_U W1
ラ ン ナ ウェ ー	R_AH1 N_AH0 W_E Y2
ラ ン ナ ウェ イ	R_AH1 N_AH0 W_E Y2
ラ ン ナ ウ エ イ	R_AH1 N_AH0 W_E Y2
ラ ン ナ ー	R_AH1 N_E R0
ラ ン ニ ン グ	R_AH1 N_IH0 N G
ラ ン ニ ン グ ホ ー ム ラ ン	R_AH1 N_IH0 N G HH_O W1 M R_AH1 N
ラ ン ニ ン グ ホ ー マ ー	R_AH1 N_IH0 N G HH_O W1 M_E R0
ラ ン ニ ン グ パ ン ツ	R_AH1 N_IH0 N G SH_AO1 R T S
ラ ン ウェ ー	R_AH1 N W_E Y2
ラ ン ウ エ ー	R_AH1 N W_E Y2
ラ ン ウェ イ	R_AH1 N W_E Y2
ラ ン ウ エ イ	R_AH1 N W_E Y2
ル ピ ー	R_U W0 P_I Y1
ル ピ ア	R_U W0 P_A Y1 AH0
ラ プ チャ ー ディ ス ク	R_AH1 P CH_E R0 D_IH1 S K
ル ー ラ ル	R_UH1 R_AH0 L
ラッ シュ	R_AH1 SH
ラッ シャ ー	R_AH1 SH_E R0
ラ ス ク	R_AH1 S K
ラッ セ ル	R_AH1 S_AH0 L
ロ シ ア ン ル ー レッ ト	R_AH1 SH_AH0 N R_U W0 L_EH1 T
ル タ バ ガ	R_U W1 T_AH0 B_E Y0 G_AH0
ル チ ル	R_U W1 T_I Y0 L
ル ワ ン ダ	R_AH0 W_AA1 N D_AH0
エ ス ラ ム	EH1 S R_AE1 M
サ バ ティ カ ル	S_AH0 B_AE1 T_IH0 K_AH0 L
サ ー ベ ル	S_AA0 B_EH1 L
サ ブ レ	S_E Y1 B_AH0 L
サ ブ レ ー	S_E Y1 B_AH0 L
セ ー ブ ル	S_E Y1 B_AH0 L
サ ボ タ ー ジ	S_AE1 B_AH0 T_AA2 ZH
サ ボ タ ー ジュ	S_AE1 B_AH0 T_AA2 ZH
サ ー ブ ル	S_E Y1 B_E R0
サ ブ リ ナ パ ン ツ	S_AH0 B R_I Y1 N_AH0 P_AE1 N T S
サッ カ リ ン	S_AE1 K_E R0 AH0 N
サッ ク	S_AE1 K
ザッ ク	S_AE1 K
サ ク ラ メ ン ト	S_AE1 K R_AH0 M_AH0 N T
サ ク リ ファ イ ス	S_AE1 K R_AH0 F_A Y2 S
サッ ド マッ ク	S_AE1 D M_AE1 K
サ ド ル	S_AE1 D_AH0 L
サ ジ ズ ム	S_E Y1 D_IH0 Z_AH0 M
サ ディ ズ ム	S_E Y1 D_IH0 Z_AH0 M
サ ディ ス ト	S_E Y1 D_AH0 S T
サ ディ ス ティッ ク	S_AH0 D_IH1 S T_IH0 K
サ ファ リ	S_AH0 F_AA1 R_I Y0
セ ー フ	S_E Y1 F
