キ ー プ	K_I Y1 P
キ ー プ ア ラ イ ブ	K_I Y1 P AH0 L_A Y1 V
キ ー パ ー	K_I Y1 P_E R0
ケ グ	K_EH1 G
ケ ル プ	K_EH1 L P
ケ ル ビ ン	K_EH1 L V_AH0 N
ケ ン ネ ル	K_EH1 N_AH0 L
キ ー ノ ー	K_I Y1 N_O W0
キ ノ	K_I Y1 N_O W0
ケ ン タッ キ ー	K_AH0 N T_AH1 K_I Y0
ケ ン タッ キ ー フ ラ イ ド チ キ ン	K_AH0 N T_AH1 K_I Y0 F R_A Y1 D CH_IH1 K_AH0 N
ケ ニ ア	K_EH1 NY_AH0
ケ ニ ヤ	K_EH1 NY_AH0
ケ ラ チ ン	K_EH1 R_AH0 T_AH0 N
カ ー ミッ ト	K_E R1 M_IH0 T
カ ー ン	K_E R1 N
カ ー ン ア ー ク	K_E R1 N AA1 R K
カ ー ネ ル	K_E R1 N_AH0 L
ケ ル ナ ー	K_E R1 N_E R0
ケ ロ シ ン	K_EH1 R_AH0 S_I Y2 N
ケッ チ	K_EH1 CH
ケ チャッ プ	K_EH1 CH_AH0 P
ケ ト	K_E Y1 T_O W0
ケ ト ン	K_I Y1 T_O W0 N
ケッ ト ル	K_EH1 T_AH0 L
ケ ト ル	K_EH1 T_AH0 L
キ ー	K_I Y1
キ ー マッ プ	K_I Y1 M_AE1 P
キ ー プ レ ー ヤ	K_I Y1 P L_E Y1 E R0
キ ー プ レ ー ヤ ー	K_I Y1 P L_E Y1 E R0
キ ー プ レ イ ヤ ー	K_I Y1 P L_E Y1 E R0
キ ー レ セ プ タ ク ル	K_I Y1 R_AH0 S_EH1 P T_AH0 K_AH0 L
キ ー ス ト ロ ー ク	K_I Y1 S T R_O W1 K
キ ー テ ク ノ ロ ジ ー	K_I Y1 T_EH0 K N_AA1 L_AH0 JH_I Y0
キ ー タッ チ	K_I Y1 T_AH1 CH
キ ー ボ ー ド	K_I Y1 B_AO2 R D
キ ー ボ ー ド エ ン ハ ン サ	K_I Y1 B_AO2 R D EH0 N HH_AE1 N S_E R0
キ ー ホ ー ル	K_I Y1 HH_O W2 L
キ ー ホ ー ル ジャ ー ナ リ ズ ム	K_I Y1 HH_O W2 L JH_E R1 N_AH0 L_IH2 Z_AH0 M
キ ー イ ン グ	K_I Y1 IH0 N G
キ ー レ ス	K_I Y1 L_AH0 S
キ ー ノ ー ト	K_I Y1 N_O W2 T
キ ー パッ ド	K_I Y1 P_AE2 D
キ ー ス ト ー ン	K_I Y1 S T_O W2 N
キ ー ワ ー ド	K_I Y1 W_E R2 D
キ イ ワ ー ド	K_I Y1 W_E R2 D
カ ー キ	K_AA1 K_I Y0
カ ー キ ー	K_AA1 K_I Y0
ハ ー ン	K_AA1 N
ハ ガ ン	K_AA1 N
ハ ン	K_AA1 N
ハ ル ツ ー ム	K_AA2 R T_U W1 M
キ ブ ツ	K_IH0 B_UH1 T S
キッ ク	K_IH1 K
キッ ク バッ ク	K_IH1 K B_AE2 K
キッ カ ー	K_IH1 K_E R0
キッ ク オ フ	K_IH1 K_AO2 F
キッ ド	K_IH1 D
キ ディ	K_IH1 D_I Y0
キ ディ ー	K_IH1 D_I Y0
キッ ド ナッ プ	K_IH1 D N_AE2 P
キ ド ニ ー	K_IH1 D N_I Y0
キ ド ニ ー パ イ	K_IH1 D N_I Y0 P_A Y1
キッ ズ	K_IH1 D Z
キ エ フ	K_I Y2 EH1 V
キ ガ リ	K_I Y0 G_AA1 L_I Y0
キ ル	K_IH1 L
キ ラ ー	K_IH1 L_E R0
キ ロ ビッ ト	K_IH1 L_AH0 B_IH0 T
キ ロ バ イ ト	K_IH1 L_O W0 B_A Y2 T
キ ロ メ ー タ ー	K_AH0 L_AA1 M_AH0 T_E R0
キ ロ ワッ ト	K_IH1 L_AH0 W_AA2 T
キ ナ ー ゼ	K_A Y1 N_E Y2 Z
キ ネ シ オ ロ ジ ー	K_IH2 N_IH0 S_I Y2 AA1 L_AH0 JH_I Y0
キ ン グ	K_IH1 N G
キ ン グ サ イ ズ	K_IH1 N G S_A Y1 Z
キ ン グ ダ ム	K_IH1 N G D_AH0 M
キ ン グ メ ー カ ー	K_IH1 N G M_E Y2 K_E R0
キ ン グ ピ ン	K_IH1 N G P_IH2 N
キ ン グ ス ト ン	K_IH1 N G S T_AH0 N
キ ン シャ サ	K_IH0 N SH_AA1 S_AH0
キ オ ス ク	K_I Y1 AO2 S K
キ ヨ ス ク	K_I Y1 AO2 S K
キッ プ	K_IH1 P
キッ パ ー	K_IH1 P_E R0
キ リ バ ス	K_IH2 R_IH1 B_AA1 T_I Y0
キ ル シュ	K_E R1 SH
キ ス	K_IH1 S
キッ ス	K_IH1 S
キ ス カ ー ル	K_IH1 S K_E R1 L
キッ ト	K_IH1 T
キ チ ン	K_IH1 CH_AH0 N
キッ チ ン	K_IH1 CH_AH0 N
キッ チ ン プ ロ グ ラ マ ー	K_IH1 CH_AH0 N P R_O W1 G R_AE2 M_E R0
キッ チ ン ウ エ ア	K_IH1 CH_AH0 N W_EH2 R
カ イ ト	K_A Y1 T
キッ チュ	K_IH1 CH
キ ー ウィ	K_I Y1 W_I Y0
キ ー ウィ ー	K_I Y1 W_I Y0
キ ウィ	K_I Y1 W_I Y0
キ ウ イ	K_I Y1 W_I Y0
ク レ ン メ	K L_EH1 M
ニ ー	N_I Y1
ニ ー レ ン グ ス	N_I Y1 L_EH1 N G K TH
ニッ カ ー ボッ カ ー ズ	N_IH1 K_E R0 B_AA2 K_E R0 Z
ニッ カ ー ズ	N_IH1 K_E R0 Z
ナ イ フ	N_A Y1 F
ニッ ト	N_IH1 T
ニッ ティ ン グ	N_IH1 T_IH0 N G
ニッ ト ウェ ア	N_IH1 T W_EH2 R
ニッ ト ウ エ ア	N_IH1 T W_EH2 R
ノッ ブ	N_AA1 B
ノ ブ	N_AA1 B
ノッ ク	N_AA1 K
ノッ ク バッ ティ ン グ	N_AA1 K B_AE1 T_IH0 N G
ノッ ク オ ン	N_AA1 K AA1 N
ノッ ク ダ ウ ン	N_AA1 K D_A W2 N
ノッ キ ン グ	N_AA1 K_IH0 N G
ノッ ク ア ウ ト	N_AA1 K_A W2 T
ノッ ト	N_AA1 T
ノ ウ	N_O W1
ノ ー ハ ウ	N_O W1 HH_A W1
ノ ウ ハ ウ	N_O W1 HH_A W1
ナ レッ ジ	N_AA1 L_AH0 JH
ノ リッ ジ	N_AA1 L_AH0 JH
ノ レッ ジ	N_AA1 L_AH0 JH
ナ レッ ジ マ ネ ー ジ メ ン ト	N_AA1 L_AH0 JH M_AE1 N_AH0 JH M_AH0 N T
ナッ ク ル	N_AH1 K_AH0 L
ナッ ク ル フォ ア	N_AH1 K_AH0 L F_AO1 R
ク ヌ ー セ ン セ ル	K N_U W1 D S_AH0 N S_EH1 L
コ ア ラ	K_O W0 AA1 L_AH0
コ ー ル ラ ビ	K_AO0 L R_AA1 B_I Y0
コッ ク	K_AA1 K
コ ム ソ モ ー ル	K_AA1 M S_O W0 M_AH0 L
コ ナ	K_O W1 N_AH0
ク ー キ ー	K_U W1 K_I Y0
コ ラ	K_AO1 R_AH0
コ リ ア	K_AO2 R_I Y1 AH0
コ リ ア ン	K_AO2 R_I Y1 AH0 N
コ リ ア タ ウ ン	K_AO2 R_I Y1 AH0 T_A W2 N
コ ル ナ	K_AO0 R_U W1 N_AA2
コ ー シェ	K_O W1 SH_E R0
コ ー シェ ル	K_O W1 SH_E R0
コ ー シャ	K_O W1 SH_E R0
コ ー シャ ー	K_O W1 SH_E R0
コ シェ ル	K_O W1 SH_E R0
コ シャ	K_O W1 SH_E R0
コ ソ ヴォ	K_O W1 S_O W0 V_O W2
コ ソ ボ	K_O W1 S_O W0 V_O W2
ク リ ル	K R_IH1 L
ク リ シュ ナ	K R_IH1 SH N_AH0
ク ロ ー ナ	K R_O W1 N_AH0
ク ロ ー ネ	K R_O W1 N_AH0
ク ル ー ガ ー ラ ン ド	K R_U W0 G_EH1 R_AE0 N D
ク ルッ プ	K R_AH1 P
ク リ プ ト ン	K R_IH1 P T_AO0 N
ク ー ナ	KY_U W1 N_AH0
ク ル ド	K_E R1 D
キ ル ク	K_E R1 K
コ ル ク	K_E R1 K
ク ワ ン ザ	K W_AA1 N Z_AH0
キ ル ギ ス タ ン	K_IH1 R G_IH0 S T_AE2 N
ラ	L_AA1
ラ ボ	L_AE1 B
ラ ベ ル	L_E Y1 B_AH0 L
レ ー ベ ル	L_E Y1 B_AH0 L
ラ ベ リ ン グ	L_E Y1 B_AH0 L_IH0 N G
レ イ バ ー	L_E Y1 B_E R0
ラ ボ ラ ト リ ー ズ	L_AE1 B R_AH0 T_AO2 R_I Y0 Z
ラ ボ ラ ト リ	L_AE1 B R_AH0 T_AO2 R_I Y0
ラ ボ ラ ト リ ー	L_AE1 B R_AH0 T_AO2 R_I Y0
ラ ブ ラ ド ー ル	L_AE1 B R_AH0 D_AO2 R
ラ ブ ラ ド ル	L_AE1 B R_AH0 D_AO2 R
ラ ビ リ ン ス	L_AE1 B_E R0 IH2 N TH
レ ー ス	L_E Y1 S
ラッ カ ー	L_AE1 K_E R0
ラ ク ロ ス	L_AH0 K R_AO1 S
ラ ク タ ー ゼ	L_AE1 K T_E Y2 S
ラ ク ト ン	L_AE1 K T_O W0 N
ラ ク ト ー ス	L_AE1 K T_O W0 S
レ ー シ ー	L_E Y1 S_I Y0
レ ー ディ ー ス	L_E Y1 D_I Y2 Z
レ ー ディ ス	L_E Y1 D_I Y2 Z
レ ディ ー ス	L_E Y1 D_I Y2 Z
レ ディ ー ズ	L_E Y1 D_I Y2 Z
レ ディ ス	L_E Y1 D_I Y2 Z
レ ディ ズ	L_E Y1 D_I Y2 Z
レ ー ド ル	L_E Y1 D_AH0 L
レ ディ	L_E Y1 D_I Y0
レ ディ ー	L_E Y1 D_I Y0
ラ ー ゲ	L_E Y1 JH
ラ ガ ー	L_AA1 G_E R0
ラ グ ー ン	L_AH0 G_U W1 N
レ ー ク	L_E Y1 K
レ イ ク	L_E Y1 K
レ ー ク サ イ ド	L_E Y1 K S_A Y2 D
レ イ ク サ イ ド	L_E Y1 K S_A Y2 D
ラ ム	L_AE1 M
ラ ム ダ ロ ケッ ト	L_AE1 M D_AH0 R_AA1 K_AH0 T
ラ ム ズ イ ヤ ー	L_AE1 M Z I Y1 R
ラ ミ ネ ー ト	L_AE1 M_AH0 N_E Y2 T
ラ ミ ネ ー ト ス キ ー	L_AE1 M_AH0 N_E Y2 T S K_I Y1
ラ ン プ	L_AE1 M P
ラ ン プ ー ン	L_AE0 M P_U W1 N
ラ ナ イ	L_AH0 N_A Y1
ラ ン ス	L_AE1 N S
ラ ン サ ー	L_AE1 N S_E R0
ラ ン セッ ト	L_AE1 N S_AH0 T
ラ ン ド	L_AE1 N D
ラ ン ディ ン グ	L_AE1 N D_IH0 N G
ラ ン ド マ ー ク	L_AE1 N D M_AA2 R K
ラ ン ド サッ ト	L_AE1 N D S_AE1 T
ラ ン ド ス ケ ー プ	L_AE1 N D S K_E Y2 P
レ ー ン	L_E Y1 N
レ イ ン	L_E Y1 N
ラ ン ゲ ー ジ	L_AE1 N G G W_AH0 JH
ラ ン タ ナ	L_AE0 N T_AE1 N_AH0
ラッ プ	L_AE1 P
ラ パ ロ ス コ ピ	L_AE2 P_E R0 AA1 S K_AH0 P_I Y0
ラ パ ロ ス コ ピ ー	L_AE2 P_E R0 AA1 S K_AH0 P_I Y0
ラ プ ス	L_AE1 P S
ラッ プ トッ プ	L_AE1 P T_AA2 P
ラ ー ド	L_AA1 R D
ラ ー ジ	L_AA1 R JH
ラ ル ゴ	L_AA1 R G_O W0
ラ リ ア ー ト	L_EH1 R_I Y0 AH0 T
ラ リ アッ ト	L_EH1 R_I Y0 AH0 T
ラ ー ク	L_AA1 R K
ラ ザ ー ニェ	L_AA0 S_AA1 NY_AH0
ラ ザ ー ニャ	L_AA0 S_AA1 NY_AH0
ラ ザ ニ ア	L_AA0 S_AA1 NY_AH0
ラ ザ ニ エ	L_AA0 S_AA1 NY_AH0
ラ サ ニ ヤ	L_AA0 S_AA1 NY_AH0
レ ー ザ	L_E Y1 Z_E R0
レ ー ザ ー	L_E Y1 Z_E R0
レ ー ザ ー ダ イ オ ー ド	L_E Y1 Z_E R0 D_A Y1 O W2 D
ラ ス ト	L_AE1 S T
ラ ス ト ボ ス	L_AE1 S T B_AA1 S
ラッ チ	L_AE1 CH
レ イ テ ン シ	L_E Y1 T_AH0 N S_I Y0
レ イ テ ン シ ー	L_E Y1 T_AH0 N S_I Y0
ラ テッ ク ス	L_E Y1 T_EH2 K S
ラ ス	L_AE1 TH
レ ー ス	L_E Y1 DH
ラ チ チュ ー ド	L_AE1 T_AH0 T_U W2 D
ラ チ ス	L_AE1 T_AH0 S
ラ ティ ス	L_AE1 T_AH0 S
ラ ト ヴィ ア	L_AE1 T V_I Y0 AH0
ラ ト ビ ア	L_AE1 T V_I Y0 AH0
ラ ー ン チ	L_AO1 N CH
ラ ウ ン チ	L_AO1 N CH
ラ ン チ	L_AO1 N CH
ロ ー ン チ	L_AO1 N CH
ロ ン チ	L_AO1 N CH
ラ ー ン チャ	L_AO1 N CH_E R0
ラ ン チャ ー	L_AO1 N CH_E R0
ロ ー ン ダ リ ン グ	L_AO1 N D_E R0 IH0 N G
ロ ン ダ リ ン グ	L_AO1 N D_E R0 IH0 N G
ロ ー ン ド ロ マッ ト	L_AO1 N D R_AH0 M_AE2 T
ラ ン ド リ ー	L_AO1 N D R_I Y0
ロ ー ン ドゥ リ ー	L_AO1 N D R_I Y0
ロ ー レ ル	L_AO1 R_AH0 L
ラ ー バ	L_AA1 V_AH0
ラ バ	L_AA1 V_AH0
ラ バ ト リ ー	L_AE1 V_AH0 T_AO2 R_I Y0
ラ ベ ン ダ ー	L_AE1 V_AH0 N D_E R0
ラ ビ ー	L_E Y1 V_I Y0
ロ ー	L_AO1
ロ ー レ ン シ ウ ム	L_AO0 R_EH1 N S_I Y0 AH0 M
レ イ アッ プ	L_E Y1 AH1 P
レ イ ヤ	L_E Y1 E R0
レ イ ヤ ー	L_E Y1 E R0
レ ヤ ー ケ ー キ	L_E Y1 E R0 K_E Y1 K
レ イ ヤ ー ド	L_E Y1 E R0 D
レ イ マ ン	L_E Y1 M_AH0 N
レ イ オ フ	L_E Y1 AO2 F
レ イ ア ウ ト	L_E Y1 A W2 T
レ イ ア ウ ト シ ス テ ム	L_E Y1 A W2 T S_IH1 S T_AH0 M
リ ー ド イ ン	L_EH1 D IH0 N
リ ー ド ア ウ ト	L_EH1 D A W1 T
リ ー ダ	L_I Y1 D_E R0
リ ー ダ ー	L_I Y1 D_E R0
リ ー ダ ー シッ プ	L_I Y1 D_E R0 SH_IH2 P
レ ディ ン グ	L_I Y1 D_IH0 N G
リ ー ズ ア ン ド ラッ グ ズ	L_I Y1 D Z AH0 N D L_AE1 G Z
リ ー フ レッ ト	L_I Y1 F L_AH0 T
リ ー グ	L_I Y1 G
リ ー ガ ー	L_I Y1 G_E R0
リ ー ク	L_I Y1 K
リ ー ケ ー ジ	L_I Y1 K_AH0 JH
リ ー キ ー	L_I Y1 K_I Y0
リ ー ン バ ー ン	L_I Y1 N B_E R1 N
ラ ー ニ ン グ	L_E R1 N_IH0 N G
リ ー ス	L_I Y1 S
リ ー シュ	L_I Y1 SH
レ ー ザ ー	L_EH1 DH_E R0
レ ザ ー	L_EH1 DH_E R0
リ ー ブ	L_I Y1 V
リ ー ビ ン グ	L_I Y1 V_IH0 N G
レ シ チ ン	L_EH1 S_AH0 TH_AH0 N
レ ク チャ	L_EH1 K CH_E R0
レ ク チャ ー	L_EH1 K CH_E R0
レ ク チャ ラ ー	L_EH1 K CH_E R0 E R0
リ ー チ	L_I Y1 CH
リ ー キ	L_I Y1 K
レ フ ト	L_EH1 F T
レ フ ティ	L_EH1 F T_I Y0
レ フ ティ ー	L_EH1 F T_I Y0
レ グ	L_EH1 G
レッ グ	L_EH1 G
レッ グ ガ ー ス	L_EH1 G G_AA1 R D Z
レッ グ ガ ー ズ	L_EH1 G G_AA1 R D Z
レ ガ シ	L_EH1 G_AH0 S_I Y0
レ ガ シ ー	L_EH1 G_AH0 S_I Y0
リ ー ガ ル	L_I Y1 G_AH0 L
レ ガ ー ト	L_AH0 G_AA1 T_O W2
レ ジェ ン ド	L_EH1 JH_AH0 N D
レ ギ ン ス	L_EH1 G_IH0 N G Z
レ グ ホ ー ン	L_EH1 G HH_AO0 R N
レ グ ホ ン	L_EH1 G HH_AO0 R N
レ ギ オ ン	L_I Y1 JH_AH0 N
レ ジ ティ マ シ ー	L_AH0 JH_IH1 T_AH0 M_AH0 S_I Y0
レ イ	L_E Y1
レ ジャ ー	L_EH1 ZH_E R0
ラッ タ ル	L_A Y1 T_E R0
ラ イ ト モ チ ー フ	L_A Y1 T M_O W0 T_I Y2 F
レッ ク	L_EH1 K
レ ン ベ ル ガ ー	L_EH1 M B_E R0 G_E R0
レ ン マ	L_EH1 M_AH0
レ ミ ン グ	L_EH1 M_IH0 N G
レ モ ン ス カッ シュ	L_EH1 M_AH0 N S K W_AA1 SH
レ モ ネ ー ド	L_EH1 M_AH0 N_E Y1 D
レ ン グ ス	L_EH1 N G K TH
レ ー ニ ン	L_EH1 N_AH0 N
レ ー ニ ニ ズ ム	L_EH1 N_IH0 N_IH2 Z_AH0 M
レ ン ズ	L_EH1 N Z
レ ン チ ル	L_EH1 N T_AH0 L
レ ン ト	L_EH1 N T_O W0
リ ー オ ウ	L_I Y1 O W0
レ オ	L_I Y1 O W0
レ オ パ ー ド	L_EH1 P_E R0 D
レ オ タ ー ド	L_I Y1 AH0 T_AA2 R D
レ ス ビ ア ン	L_EH1 Z B_I Y0 AH0 N
レ ズ ビ ア ン	L_EH1 Z B_I Y0 AH0 N
レ ズ ビ ア ニ ズ ム	L_EH1 Z B_I Y0 AH0 N_IH0 Z M
レ ソ ト	L_EH0 S_O W1 TH_O W0
レッ ス ン	L_EH1 S_AH0 N
レッ ト	L_EH1 T
レッ ツ	L_EH1 T S
レッ ツ ラ ゴ ー	L_EH1 T S G_O W1
レ タ ー	L_EH1 T_E R0
レッ テ ル	L_EH1 T_E R0
レ タ ー ファッ ク ス	L_EH1 T_E R0 F_AE1 K S
レ タ リ ン グ	L_EH1 T_E R0 IH0 N G
レ タ ス	L_EH1 T_AH0 S
レ ウ	L_U W1
レ ビ	L_EH1 V_I Y0
レ ヴェ ル	L_EH1 V_AH0 L
レ ベ ル	L_EH1 V_AH0 L
レ ベ ル オ フ	L_EH1 V_AH0 L AO1 F
レ ベ リ ン グ	L_EH1 V_AH0 L_IH0 N G
レ バ ー	L_EH1 V_E R0
レ バ レッ ジ	L_EH1 V_E R0 IH0 JH
レ ヴィ ア タ ン	L_EH0 V_A Y1 AH0 TH_AH0 N
レ ビ ヤ タ ン	L_EH0 V_A Y1 AH0 TH_AH0 N
リ ヴァ イ ア サ ン	L_EH0 V_A Y1 AH0 TH_AH0 N
リ バ イ ア サ ン	L_EH0 V_A Y1 AH0 TH_AH0 N
リ ー バ イ ス	L_I Y1 V_A Y0 Z
レ キ シ カ ル	L_EH1 K S_IH0 K_AH0 L
レ キ シ コ グ ラ ファ ー	L_EH2 K S_IH0 K_AA1 G R_AH0 F_E R0
レ キ シ コ ン	L_EH1 K S_IH0 K_AA2 N
ラ サ	L_AA1 S_AH0
ラ イ ア ビ リ ティ ー	L_A Y2 AH0 B_IH1 L_IH0 T_I Y0
リ エ ゾ ン	L_I Y0 E Y1 Z_AA2 N
ラ イ ア ー	L_A Y1 E R0
リ ベ ラ ル	L_IH1 B_E R2 AH0 L
リ ベ ラ リ ズ ム	L_IH1 B_E R2 AH0 L_IH2 Z_AH0 M
リ バ タ リ ア ン	L_IH2 B_E R2 T_EH1 R_I Y2 AH0 N
リ バ ティ ー	L_IH1 B_E R0 T_I Y2
リ ビ ド ー	L_AH0 B_A Y1 D_O W2
ラ イ ブ ラ リ ア ン	L_A Y0 B R_EH1 R_I Y2 AH0 N
ラ イ ブ ラ リ	L_A Y1 B R_EH0 R_I Y2
ラ イ ブ ラ リ ー	L_A Y1 B R_EH0 R_I Y2
リ ブ レッ ト	L_IH0 B R_EH1 T_O W2
ラ イ セ ン ス	L_A Y1 S_AH0 N S
ラ イ セ ン シ ー	L_A Y2 S_AH0 N S_I Y1
ラ イ セ ン サ	L_A Y1 S_AH0 N S_E R0
ラ イ セ ン サ ー	L_A Y1 S_AH0 N S_E R0
ラ イ セ ン シ ン グ	L_A Y1 S_AH0 N S_IH0 N G
リッ ク	L_IH1 K
リ コ リ ス	L_IH1 K_E R0 IH0 SH
ラ イ	L_A Y1
リ ー ベ	L_I Y1 B
リ ヒ テ ン シュ タ イ ン	L_IH1 K T_AH0 N S T_A Y2 N
リ ー ト	L_A Y1 D
リ ー ド	L_A Y1 D
ラ イ フ	L_A Y1 F
ラ イ フ セ ー ビ ン グ	L_A Y1 F S_E Y1 V_IH0 N G
ラ イ フ サ ー ビ ス	L_A Y1 F S_E R1 V_AH0 S
ラ イ フ サ イ ズ	L_A Y1 F S_A Y1 Z
ラ イ フ ボ ー ト	L_A Y1 F B_O W2 T
ラ イ フ ラ イ ン	L_A Y1 F L_A Y2 N
ラ イ フ セ ー バ ー	L_A Y1 F S_E Y2 V_E R0
ラ イ フ ス タ イ ル	L_A Y1 F S T_A Y2 L
ラ イ フ タ イ ム	L_A Y1 F T_A Y2 M
リ ー フォ ー	L_I Y1 F_O W0
リ フ ト	L_IH1 F T
リ フ ト アッ プ	L_IH1 F T AH1 P
リ フ ティ ン グ	L_IH1 F T_IH0 N G
リ ガ ン ド	L_IH1 G_AH0 N D
ラ イ ト	L_A Y1 T
ラ イ ト ボ タ ン	L_A Y1 T B_AH1 T_AH0 N
ラ イ ト ノ ベ ル	L_A Y1 T N_AA1 V_AH0 L
ラ イ ト ツ ナ フ レ ー ク	L_A Y1 T T_U W1 N_AH0 F L_E Y1 K
ラ イ タ	L_A Y1 T_E R0
ラ イ タ ー	L_A Y1 T_E R0
ラ イ ト ハ ウ ス	L_A Y1 T HH_A W2 S
ラ イ ティ ン グ	L_A Y1 T_IH0 N G
ラ イ ト ニ ン グ	L_A Y1 T N_IH0 N G
ラ イ ト ウ エ ー ト	L_A Y1 T W_E Y1 T
リ グ ニ ン	L_IH1 G N_IH0 N
ラ イ ク	L_A Y1 K
リ ク ー ド	L_IH1 K_AH0 D
ラ イ ラッ ク	L_A Y1 L_AE2 K
リ リ ー	L_IH1 L_I Y0
リ リ ア ン	L_IH1 L_I Y0 Y_AA1 R N
リ リ ヤ ン	L_IH1 L_I Y0 Y_AA1 R N
リ マ	L_A Y1 M_AH0
リ ン ボ ー	L_IH1 M B_O W0
ラ イ ム ラ イ ト	L_A Y1 M L_A Y2 T
リ メ リッ ク	L_IH1 M_E R0 IH0 K
リ ミッ ト	L_IH1 M_AH0 T
リ ミッ ト サ イ ク ル	L_IH1 M_AH0 T S_A Y1 K_AH0 L
リ ミ テ ー ショ ン	L_IH2 M_IH0 T_E Y1 SH_AH0 N
リ ミ ティッ ド	L_IH1 M_AH0 T_AH0 D
リ ミ テッ ド	L_IH1 M_AH0 T_AH0 D
リ ム ジ ー ン	L_IH1 M_AH0 Z_I Y2 N
リ ム ジ ン	L_IH1 M_AH0 Z_I Y2 N
リ ン デ ン	L_IH1 N D_AH0 N
リ ン デ ン バ ウ ム	L_A Y1 N D_AH0 N B_A W0 M
リ ン ディ ホッ プ	L_IH1 N D_I Y0 HH_AA1 P
ラ イ ン	L_A Y1 N
ラ イ ン フィ ー ド	L_A Y1 N F_I Y1 D
ラ イ ナッ プ	L_A Y1 N AH1 P
ラ イ ン アッ プ	L_A Y1 N AH1 P
ラ イ ン ナッ プ	L_A Y1 N AH1 P
リ ネ ー ジ	L_IH1 N_I Y0 AH0 JH
リ ニ ア	L_IH1 N_I Y0 E R0
ラ イ ン バッ カ ー	L_A Y1 N B_AE2 K_E R0
ラ イ ン マ ン	L_A Y1 N M_AH0 N
ラ イ ン メ ン	L_A Y1 N M_AH0 N
リ ネ ン	L_IH1 N_AH0 N
ラ イ ナ ー	L_A Y1 N_E R0
ラ ン ジェ リ ー	L_AA1 N ZH_E R0 E Y2
リ ン グィ ー ネ	L_IH0 N G G W_I Y1 N_I Y0
リ ン グ イ ー ネ	L_IH0 N G G W_I Y1 N_I Y0
リ ン グ イ ネ	L_IH0 N G G W_I Y1 N_I Y0
ラ イ ニ ン グ	L_A Y1 N_IH0 N G
リ ン ク	L_IH1 N G K
リ ン ケ ー ジ	L_IH1 N G K_AH0 JH
リ ン ク ト マ ル チ セッ ショ ン	L_IH1 N G K T M_AH1 L T_I Y0 S_EH1 SH_AH0 N
リ ン カ	L_IH1 N G K_E R0
リ ン カ ー	L_IH1 N G K_E R0
リ ン ク ス	L_IH1 N G K S
リ ノ リ ウ ム	L_AH0 N_O W1 L_I Y0 AH0 M
ラ イ ノ タ イ プ	L_IH1 N_O W0 T_A Y2 P
リ ン ト	L_IH1 N T
ラ イ ナッ ク ス	L_IH1 N_AH0 K S
リ ナッ ク ス	L_IH1 N_AH0 K S
リ ニ ク ス	L_IH1 N_AH0 K S
リ ヌ ク ス	L_IH1 N_AH0 K S
リ ヌッ ク ス	L_IH1 N_AH0 K S
ラ イ オ ン	L_A Y1 AH0 N
リッ プ	L_IH1 P
リ ピ ド	L_A Y1 P_AH0 D
リ ポ ソ ー ム	L_IH1 P_AH0 S_O W2 M
リッ プ ス ティッ ク	L_IH1 P S T_IH2 K
リ キュ ー ル	L_IH0 K_E R1
リ キッ ド	L_IH1 K W_AH0 D
リ カ ー	L_IH1 K_E R0
リ ラ	L_IH1 R_AH0
リ ス ボ ア	L_IH1 Z B_AH0 N
リ ス ボ ン	L_IH1 Z B_AH0 N
リ ス ト	L_IH1 S T
リ ス ト プ ロ ー カ ー	L_IH1 S T B R_O W1 K_E R0
リッ ス ン	L_IH1 S_AH0 N
リ ス ナ	L_IH1 S_AH0 N_E R0
リ ス ナ ー	L_IH1 S_AH0 N_E R0
リ ス ニ ン グ	L_IH1 S_AH0 N_IH0 N G
リ ス ティ ン グ	L_IH1 S T_IH0 N G
リ タ ラ シ ー	L_IH1 T_E R0 AH0 S_I Y0
リ テ ラ シ	L_IH1 T_E R0 AH0 S_I Y0
リ テ ラ シ ー	L_IH1 T_E R0 AH0 S_I Y0
リ テ ラ ル	L_IH1 T_E R0 AH0 L
リ テ ラ チャ ー	L_IH1 T_E R0 AH0 CH_E R0
リ テ ラ チュ ア	L_IH1 T_E R0 AH0 CH_E R0
リ チ ウ ム	L_IH1 TH_I Y0 AH0 M
リ ト グ ラ フ	L_IH1 TH_AH0 G R_AE2 F
リ ソ グ ラ フィ	L_AH0 TH_AA1 G R_AH0 F_I Y0
リ ソ グ ラ フィ ー	L_AH0 TH_AA1 G R_AH0 F_I Y0
リ ト グ ラ フィ	L_AH0 TH_AA1 G R_AH0 F_I Y0
リ ト グ ラ フィ ー	L_AH0 TH_AA1 G R_AH0 F_I Y0
リ ト ア ニ ア	L_IH2 TH_AH0 W_E Y1 N_I Y0 AH0
リ ト マ ス	L_IH1 T M_AH0 S
リ ト ル	L_IH1 T_AH0 L
ラ イ ヴ	L_A Y1 V
ラ イ ブ	L_A Y1 V
リ バ ー	L_IH1 V_E R0
リ バ リ ー	L_IH1 V_E R0 I Y0
リ ビ ン グ	L_IH1 V_IH0 N G
リ ザ ー ド	L_IH1 Z_E R0 D
リュ ブ リャ ー ナ	LY_U W1 B LY_AA0 N_AH0
リュ ブ リャ ナ	LY_U W1 B LY_AA0 N_AH0
ラ マ	L_AA1 M_AH0
リャ マ	L_AA1 M_AH0
ロ ー ファ イ	L_O W1 F_A Y1
ロ ー ド セッ ト ピ リ オ ド	L_O W1 D S_EH1 T P_IH1 R_I Y0 AH0 D
ロ ー ダ	L_O W1 D_E R0
ロ ー ダ ー	L_O W1 D_E R0
ロ ー ディ ン グ	L_O W1 D_IH0 N G
ロ ー ファ	L_O W1 F_E R0 Z
ロ ー ファ ー	L_O W1 F_E R0 Z
ロ ー ファ ー ズ	L_O W1 F_E R0 Z
ロ ー ム	L_O W1 M
ロ ー ン	L_O W1 N
ロ ブ	L_AA1 B
ロ ビ ン グ	L_AA1 B_IH0 N G
ロ ビ ー	L_AA1 B_I Y0
ロ ビ ー イ ン グ	L_AA1 B_I Y0 IH0 N G
ロ ビ イ ン グ	L_AA1 B_I Y0 IH0 N G
ロ ビ イ ス ト	L_AA1 B_I Y0 AH0 S T
ロ ボ ト ミ ー	L_O W1 B_O W2 T_O W2 M_I Y0
ロ ブ ス タ	L_AA1 B S T_E R0
ロ ブ ス タ ー	L_AA1 B S T_E R0
ロ ー カ ル	L_O W1 K_AH0 L
ロ カ ー ル	L_O W0 K_AE1 L
ロ ケ ー ル	L_O W0 K_AE1 L
ロ ー カ ラ イ ズ	L_O W2 K_AH0 L_AH0 Z_E Y1 SH_AH0 N
ロ ー カ ラ イ ゼ ー ショ ン	L_O W2 K_AH0 L_AH0 Z_E Y1 SH_AH0 N
ロ ー カ リ ゼ ー ショ ン	L_O W2 K_AH0 L_AH0 Z_E Y1 SH_AH0 N
ロ ケ ー ト	L_O W1 K_E Y2 T
ロ ケ ー ショ ン	L_O W0 K_E Y1 SH_AH0 N
ロ ケ ー ショ ン ハ ン ティ ン グ	L_O W0 K_E Y1 SH_AH0 N HH_AH1 N T_IH0 N G
ロ ケ ー タ	L_O W1 K_E Y2 T_E R0
ロ ケ ー タ ー	L_O W1 K_E Y2 T_E R0
ロッ ク	L_AA1 K
ロッ ク ファ イ ル	L_AA1 K F_A Y1 L
ロッ ク ダ ウ ン	L_AA1 K D_A W2 N
ロッ カ ー	L_AA1 K_E R0
ロッ ク ア ウ ト	L_AA1 K_A W2 T
ロ コ	L_O W1 K_O W0
ロ コ モ ー ショ ン	L_O W2 K_AH0 M_O W1 SH_AH0 N
ロ コ モ ー ティ ブ	L_O W2 K_AH0 M_O W1 T_IH0 V
ロ コ モ ティ ブ	L_O W2 K_AH0 M_O W1 T_IH0 V
ロッ ジ	L_AA1 JH
ロッ ジ ン グ	L_AA1 JH_IH0 N G
ロ フ ト	L_AO1 F T
ロ グ	L_AO1 G
ロ グ ハ ウ ス	L_AO1 G HH_A W1 S
ロ ガ リ ズ ム	L_AA1 G_E R0 IH2 DH_AH0 M
ロ ガ ー	L_AA1 G_E R0
ロッ ジ ア	L_AA1 G_I Y0 AH0
ロ ジッ ク	L_AA1 JH_IH0 K
ロ ジッ ク ア ナ ラ イ ザ	L_AA1 JH_IH0 K AE1 N_AH0 L_A Y2 Z_E R0
ロ ジ カ ル	L_AA1 JH_IH0 K_AH0 L
ロ グ イ ン	L_AO1 G_IH2 N
ロ ジ ス ティ ク ス	L_AH0 JH_IH1 S T_IH0 K S
ロ ジ ス ティッ ク ス	L_AH0 JH_IH1 S T_IH0 K S
ロ ゴ	L_O W1 G_O W0
ロ ゴ ス	L_O W1 G_O W2 Z
ロ ゴ タ イ プ	L_O W1 G_AH0 T_A Y2 P
ロ リ ー タ	L_O W0 L_I Y1 T_AH0
ロ リ ポッ プ	L_AA1 L_I Y0 P_AA2 P
ロ ン リ ネ ス	L_O W1 N L_I Y0 N_AH0 S
ロ ン リ ー	L_O W1 N L_I Y0
ロ ン グ	L_AO1 N G
ロ ン グ サ ー キッ ト ア ピ ー ル	L_AO1 N G S_E R1 K_AH0 T AH0 P_I Y1 L
ロ ン グ ラ イ フ ク ー ラ ン ト	L_AO1 N G L_A Y1 F K_U W1 L_AH0 N T
ロ ン グ レ ン ジ	L_AO1 N G R_E Y1 N JH
ロ ン グ ボ ウ	L_AO1 N G B_O W2
ロ ン グ ショッ ト	L_AO1 N G SH_AA2 T
ルッ ク	L_UH1 K
ルッ ク ス	L_UH1 K S
ル ー プ	L_U W1 P
ル ー プ タ イ	L_U W1 P T_A Y1
ル ー ズ	L_U W1 S
ル ー ズ リ ー フ	L_U W1 S L_I Y1 F
ル ー ス	L_U W1 S
ロ ア ー	L_AO1 R
ロ ー レ ラ イ	L_AO1 R_IH0 L_A Y2
ロ リ ス	L_AO1 R_IH0 S
ル ー ザ ー	L_U W1 Z_E R0
ロ ス	L_AO1 S
ロ ス ト	L_AO1 S T
ロ ス ト バ ゲ ー ジ	L_AO1 S T B_AE1 G_IH0 JH
ロ ス ト ジェ ネ レ ー ショ ン	L_AO1 S T JH_EH2 N_E R0 E Y1 SH_AH0 N
ロッ ト	L_AA1 T
ロッ ト ー	L_AA1 T
ロ ト	L_AA1 T
ロ ー ショ ン	L_O W1 SH_AH0 N
ロッ テ リ ー	L_AA1 T_E R0 I Y0
ロ ー タ ス	L_O W1 T_AH0 S
ラ ウ ド ス ピ ー カ ー	L_A W1 D S P_I Y2 K_E R0
ル イ ジ ア ナ	L_U W0 I Y2 Z_I Y0 AE1 N_AH0
ラ ウ ン ジ	L_A W1 N JH
ラ ウ ジ ネ ス	L_A W1 Z_I Y0 N_AH0 S
ル ー ヴ ル	L_U W1 V R_AH0
ル ー ブ ル	L_U W1 V R_AH0
ラ ヴ	L_AH1 V
ラ ブ	L_AH1 V
ラ ブ コ メ ディ ー	L_AH1 V K_AA1 M_AH0 D_I Y0
ラ ブ ホ テ ル	L_AH1 V HH_O W0 T_EH1 L
ラ ブ イ ン	L_AH1 V IH0 N
ラ ブ ラ ブ	L_AH1 V L_AH1 V
ラ ブ リ ー	L_AH1 V L_I Y0
ラ バ ー	L_AH1 V_E R0
ロ ー	L_O W1
ロ ー カ ー ボ	L_O W1 K_AA1 R B
ロ カ ボ	L_O W1 K_AA1 R B
ロ ー カッ ト	L_O W1 K_AH1 T
ロ ー ファッ ト	L_O W1 F_AE1 T
ロ ー ヒ ー ル	L_O W1 HH_I Y1 L
ロ ー キ ー	L_O W1 K_I Y1
ロ ー レ ベ ル	L_O W1 L_EH1 V_AH0 L
ロ ー プ ラ イ ス	L_O W1 P R_A Y1 S
ロ ー サ ル ファ	L_O W1 S_AH1 L F_E R0
ロッ ク ス	L_AA1 K S
ル ア ン ダ	L_U W0 AA1 N D_AH0
ル ア ウ	L_U W1 A W2
ル ブ リ ケ ー ショ ン	L_U W2 B R_IH0 K_E Y1 SH_AH0 N
ル ー セ ン ト	L_U W1 S_IH0 N T
ル ー サ ン	L_U W1 S_E R0 N
ラッ キ ー	L_AH1 K_I Y0
ラッ キィ	L_AH1 K_I Y0
リュ ー ジュ	L_U W1 JH
ラ ゲ ー ジ	L_AH1 G_AH0 JH
ラ ゲッ ジ	L_AH1 G_AH0 JH
ラッ ゲ ー ジ	L_AH1 G_AH0 JH
ラ ラ バ イ	L_AH1 L_AH0 B_A Y2
ル ー メ ン	L_U W1 M_AH0 N
ル ー メ ン	L_U W1 M_AH0 N
ル ミ ネ セ ン ス	L_U W2 M_AH0 N_EH1 S_AH0 N S
ル ミ ネッ セ ン ス	L_U W2 M_AH0 N_EH1 S_AH0 N S
ル ミ ノ ー ル	L_U W2 M_IH0 N_AO1 L
ラ ン チ	L_AH1 N CH
ラ ン チョ ン	L_AH1 N CH_AH0 N
ラ ン チ タ イ ム	L_AH1 N CH T_A Y2 M
ル ン ゲ	L_AH1 N JH
ラ ン ジ	L_AH1 N JH
ル パ ン	L_U W1 P_AH0 N
ル ー ピ ン	L_U W1 P_A Y2 N
ル ア ー	L_UH1 R
ル サ カ	L_U W0 S_AA1 K_AH0
リュ ー ト	L_U W1 T
ル ク ス	L_AH1 K S
ルッ ク ス	L_AH1 K S
リュ ク サ ン ブ ー ル	L_AH1 K S_AH0 M B_AO2 R G
ル ク セ ン ブ ル ク	L_AH1 K S_AH0 M B_AO2 R G
ラ ク シャ リ ー	L_AH1 G ZH_E R0 I Y0
ラ グ ジュ ア リ ー	L_AH1 G ZH_E R0 I Y0
ラ イ コ ス	L_A Y1 K_O W0 S
リ ディ ア	L_IH1 D_I Y0 AH0
リュ ディ ア	L_IH1 D_I Y0 AH0
リ ン チ	L_IH1 N CH
リュ ラ ー	L_A Y1 R_AH0
リ ラ	L_A Y1 R_AH0
ラ イ ア	L_A Y1 R
ラ イ ア ー	L_A Y1 R
リ リ カ ル	L_IH1 R_IH0 K_AH0 L
リ リ シ ズ ム	L_IH1 R_IH0 S_IH2 Z_AH0 M
リ リッ ク	L_IH1 R_IH0 K S
リ シ ン	L_A Y1 S_I Y0 N
リ ジ ン	L_A Y1 S_I Y0 N
リ ゾ ー ル	L_A Y1 S_AO2 L
エ ム エ ス ド ス	EH1 M EH1 S D_AO1 S
マ カ ダ ム	M_AH0 K_AE1 D_AH0 M
マ カ ダ ム ロ ー ラ ー	M_AH0 K_AE1 D_AH0 M R_O W1 L_E R0
マ カ ダ ミ ア	M_AE2 K_AH0 D_E Y1 M_I Y0 AH0
マ カ ダ ミ ア ナッ ツ	M_AE2 K_AH0 D_E Y1 M_I Y0 AH0 N_AH1 T S
マ カ ロ ニ	M_AE2 K_E R0 O W1 N_I Y0
メ ー ス	M_E Y1 S
メ イ ス	M_E Y1 S
マ ケ ド ニ ア	M_AE2 S_AH0 D_O W1 N_I Y0 AH0
マッ ハ	M_AA1 K
マ ー シュ	M_AE1 CH
マ シェッ ト	M_AH0 SH_EH1 T_I Y2
マ シェ ティ	M_AH0 SH_EH1 T_I Y2
マ チェ ー テ	M_AH0 SH_EH1 T_I Y2
マ チェッ ト	M_AH0 SH_EH1 T_I Y2
マ チェ テ	M_AH0 SH_EH1 T_I Y2
マ キ ア ヴェ リ ス ト	M_AA2 K_I Y0 AH0 V_EH1 L_I Y0 S T
マ キ ア ベ リ ス ト	M_AA2 K_I Y0 AH0 V_EH1 L_I Y0 S T
マ キャ ベ リ ス ト	M_AA2 K_I Y0 AH0 V_EH1 L_I Y0 S T
マ シ ー ン	M_AH0 SH_I Y1 N
マ シ ン	M_AH0 SH_I Y1 N
マ シ ー ン ガ ン	M_AH0 SH_I Y1 N G_AH1 N
マ シ ン ガ ン	M_AH0 SH_I Y1 N G_AH1 N
マ シ ン ラ イ ク	M_AH0 SH_I Y1 N L_A Y1 K
マ シ ン ル ー ム	M_AH0 SH_I Y1 N R_U W1 M
マ シ ン ビ ジョ ン	M_AH0 SH_I Y1 N V_IH1 ZH_AH0 N
マ シ ー ナ リ	M_AH0 SH_I Y1 N_E R0 I Y0
マ シ ー ナ リ ー	M_AH0 SH_I Y1 N_E R0 I Y0
マ チ ス モ	M_AH0 CH_IH1 Z M_O W0
マ チ ズ モ	M_AH0 CH_IH1 Z M_O W0
マッ チョ	M_AA1 CH_O W0
マッ キ ン トッ シュ	M_AE1 K_AH0 N T_AO2 SH
マ ク ラ メ	M_AE1 K R_AH0 M_E Y2
マ ク ロ	M_AE1 K R_O W0
