ア ー ド バ ー ク	AA1 R D V_AA2 R K
ア バ カ ス	AE1 B_AH0 K_AH0 S
ア バ ク ス	AE1 B_AH0 K_AH0 S
ア ブ ダ ク ショ ン	AE0 B D_AH1 K SH_AH0 N
ア ベ ン ド	AE1 B_EH0 N D
ア ー ベ ン ト	AE1 B_EH0 N D
ア ビ リ ティ ー	AH0 B_IH1 L_AH0 T_I Y2
ア ブ ノ ー マ ル	AE0 B N_AO1 R M_AH0 L
ア ブ ノ ー マ ル エ ン ド	AE0 B N_AO1 R M_AH0 L EH1 N D
ア ボ リ ジ ニ	AE2 B_E R0 IH1 JH_AH0 N_I Y0
ア ボ リ ジ ニ ー	AE2 B_E R0 IH1 JH_AH0 N_I Y0
ア ボ リ ジ ン	AE2 B_E R0 IH1 JH_AH0 N_I Y0
ア ボ ー ト	AH0 B_AO1 R T
ア ボ ー ショ ン	AH0 B_AO1 R SH_AH0 N
ア バ ウ ト	AH0 B_A W1 T
ア ブ ラ カ ダ ブ ラ	AE2 B R_AH0 K_AH0 D_AE1 B R_AH0
ア ブ セ ン ティ ズ ム	AE2 B S_AH0 N T_I Y1 IH0 Z_AH0 M
ア ブ ソ リュ ー ト	AE1 B S_AH0 L_U W2 T
ア ブ ソ ル ー ト	AE1 B S_AH0 L_U W2 T
ア ブ ソ リュ ー ティ ズ ム	AE1 B S_AH0 L_U W2 T_IH2 Z_AH0 M
ア ブ ソ ー バ ー	AH0 B Z_AO1 R B_E R0
ア ブ ス ト ラ ク ト	AE0 B S T R_AE1 K T
ア ブ ス ト ラ ク ショ ン	AE0 B S T R_AE1 K SH_AH0 N
ア ブ ダ ビ	AE1 B_U W0 D_AA1 B_I Y0
ア ビュ ー ス	AH0 BY_U W1 S
ア ビュ ー ズ	AH0 BY_U W1 S
ア ビ シ ニ ア ジャッ カ ル	AE0 B S_IH1 N_I Y2 AH0 JH_AE1 K_AH0 L
ア ビ シ ニ ア ン	AE0 B S_IH1 N_I Y2 AH0 N
ア カ シ ア	AH0 K_E Y1 SH_AH0
ア カ シ ヤ	AH0 K_E Y1 SH_AH0
ア ケ イ シャ	AH0 K_E Y1 SH_AH0
ア カ デ ミッ ク	AE2 K_AH0 D_EH1 M_IH0 K
ア カ デ ミッ ク ハ ラ ス メ ン ト	AE2 K_AH0 D_EH1 M_IH0 K HH_E R0 AE1 S M_AH0 N T
ア カ デ ミ シャ ン	AE2 K_AH0 D_AH0 M_IH1 SH_AH0 N
ア カ デ ミ ー	AH0 K_AE1 D_AH0 M_I Y0
ア キャ デ ミィ	AH0 K_AE1 D_AH0 M_I Y0
ア カ プ ル コ	AE2 K_AH0 P_UH1 L K_O W0
ア ク セ ラ レ ー タ	AE0 K S_EH1 L_E R0 E Y2 T_E R0
ア ク セ ラ レ ー タ ー	AE0 K S_EH1 L_E R0 E Y2 T_E R0
ア ク セ ル	AH0 K S_EH1 L
ア ク セ ル レ ー タ	AE0 K S_EH1 L_E R0 E Y2 T_E R0
ア ク セ レ レ ー タ ー	AE0 K S_EH1 L_E R0 E Y2 T_E R0
ア ク サ ン	AH0 K S_EH1 N T
ア ク セ ン ト	AH0 K S_EH1 N T
ア ク サ ン グ ラ ー ブ	AH0 K S_EH1 N T G R_E Y1 V
ア ク セ プ ト	AE0 K S_EH1 P T
ア ク セ プ タ ン ス	AE0 K S_EH1 P T_AH0 N S
ア ク セ ス	AE1 K S_EH2 S
ア ク セ シ ビ リ ティ	AE2 K S_EH0 S_AH0 B_IH1 L_IH0 T_I Y0
ア ク セ シ ビ リ ティ ー	AE2 K S_EH0 S_AH0 B_IH1 L_IH0 T_I Y0
ア ク セ シ ブ ル	AE0 K S_EH1 S_AH0 B_AH0 L
ア ク セッ シ ン グ	AE1 K S_EH2 S_IH0 N G
ア ク セ サ リ	AE0 K S_EH1 S_E R0 I Y0
ア ク セ サ リ ー	AE0 K S_EH1 S_E R0 I Y0
ア ク シ デ ン ト	AE1 K S_AH0 D_AH0 N T
ア ク シ デ ン タ ル	AE2 K S_AH0 D_EH1 N T_AH0 L
ア ク スィ デ ン タ ル	AE2 K S_AH0 D_EH1 N T_AH0 L
ア ク レ イ ム	AH0 K L_E Y1 M
ア コ モ デ イ ト	AH0 K_AA1 M_AH0 D_E Y2 T
ア コ モ デ ー ショ ン	AH0 K_AA2 M_AH0 D_E Y1 SH_AH0 N
ア コ モ デ イ ショ ン	AH0 K_AA2 M_AH0 D_E Y1 SH_AH0 N
ア カ ム パ ニ メ ン ト	AH0 K_AH1 M P N_IH0 M_AH0 N T
ア カ ン パ ニ メ ン ト	AH0 K_AH1 M P N_IH0 M_AH0 N T
ア コ ン パ ニ メ ン ト	AH0 K_AH1 M P N_IH0 M_AH0 N T
ア カ ム パ ニ	AH0 K_AH1 M P_AH0 N_I Y0
ア カ ン パ ニ	AH0 K_AH1 M P_AH0 N_I Y0
ア コ ン パ ニ	AH0 K_AH1 M P_AH0 N_I Y0
ア コ ン プ リ ス	AH0 K_AA1 M P L_AH0 S
ア カ ム プ リッ シュ	AH0 K_AA1 M P L_IH0 SH
ア カ ン プ リッ シュ	AH0 K_AA1 M P L_IH0 SH
ア コ ン プ リッ シ	AH0 K_AA1 M P L_IH0 SH
ア コ ン プ リッ シュ	AH0 K_AA1 M P L_IH0 SH
ア コ ー ド	AH0 K_AO1 R D
ア コ ー ディ ア ン	AH0 K_AO1 R D_I Y0 AH0 N
ア コ ー ディ オ ン	AH0 K_AO1 R D_I Y0 AH0 N
ア コ ー デ オ ン	AH0 K_AO1 R D_I Y0 AH0 N
ア カ ウ ン ト	AH0 K_A W1 N T
ア カ ウ ン タ ビ リ ティ	AH0 K_A W1 N T_AH0 B_IH2 L_IH0 T_I Y0
ア カ ウ ン タ ビ リ ティ ー	AH0 K_A W1 N T_AH0 B_IH2 L_IH0 T_I Y0
ア カ ウ ン ティ ン グ	AH0 K_A W1 N T_IH0 N G
ア ク ラ	AA1 K R_AA2
ア ク レ ジッ ト	AH0 K R_EH1 D_IH2 T
ア ク レ ディッ ト	AH0 K R_EH1 D_IH2 T
ア キュ ミュ レ イ ト	AH0 KY_U W1 MY_AH0 L_E Y2 T
ア キュ ム レ イ ト	AH0 KY_U W1 MY_AH0 L_E Y2 T
ア ク ム レ イ ト	AH0 KY_U W1 MY_AH0 L_E Y2 T
ア キュ ー ム レ ー タ	AH0 KY_U W1 MY_AH0 L_E Y2 T_E R0
ア キュ ム レ ー タ	AH0 KY_U W1 MY_AH0 L_E Y2 T_E R0
ア キュ ム レ ー タ ー	AH0 KY_U W1 MY_AH0 L_E Y2 T_E R0
ア キュ ラ シ	AE1 KY_E R0 AH0 S_I Y0
ア キュ ラ スィ	AE1 KY_E R0 AH0 S_I Y0
ア キュ レ イ ト	AE1 KY_E R0 AH0 T
ア キュ レッ ト	AE1 KY_E R0 AH0 T
ア キュ セ イ ショ ン	AE2 KY_AH0 Z_E Y1 SH_AH0 N
ア キュ ゼ イ ショ ン	AE2 KY_AH0 Z_E Y1 SH_AH0 N
エ ー ス	E Y1 S
ア セ ト ア ミ ノ フェ ン	AH0 S_I Y2 T_AH0 M_IH1 N_AH0 F_AH0 N
ア セ テ ー ト	AE1 S_AH0 T_E Y2 T
ア セ ト ン	AE1 S_AH0 T_O W2 N
ア セ チ ル コ リ ン	AH0 S_EH2 T_AH0 L K_O W1 L_I Y0 N
ア セ チ リ ー ン	AH0 S_EH1 T_AH0 L_I Y2 N
ア セ チ レ ン	AH0 S_EH1 T_AH0 L_I Y2 N
ア チ ー ヴ	AH0 CH_I Y1 V
ア チ ー ブ	AH0 CH_I Y1 V
ア キ レ ス	AH0 K_IH1 L_I Y0 Z
ア キ レ ス タ ン	AH0 K_IH1 L_I Y0 Z T_AE1 N G
ア シッ ド	AE1 S_IH0 D
ア シ ド ー シ ス	AE2 S_IH0 D_O W1 S_AH0 S
アッ ク	AE1 K
ア ク ノ リッ ジ	AE0 K N_AA1 L_IH0 JH
ア ク メ	AE1 K M_I Y0
ア ク ネ	AE1 K N_I Y0
ア コ ラ イ ト	AE1 K_AH0 L_A Y2 T
ア ク ー ス ティッ ク	AH0 K_U W1 S T_IH0 K
ア コ ー ス ティッ ク	AH0 K_U W1 S T_IH0 K
ア コ ウ ス ティッ ク	AH0 K_U W1 S T_IH0 K
ア コ ー ス ティッ ク ギ タ ー	AH0 K_U W1 S T_IH0 K G_IH0 T_AA1 R
ア ク ウェ イ ン ト	AH0 K W_E Y1 N T
ア ク エ イ ン ト	AH0 K W_E Y1 N T
ア ク ウェ イ ン タ ン ス	AH0 K W_E Y1 N T_AH0 N S
ア ク エ イ ン タ ン ス	AH0 K W_E Y1 N T_AH0 N S
ア ク イ エ ス	AE2 K W_I Y0 EH1 S
ア ク ウィ エ ス	AE2 K W_I Y0 EH1 S
ア ク ワ イ ア	AH0 K W_A Y1 E R0
ア ク ワ イ ヤ	AH0 K W_A Y1 E R0
ア ク イ ジ ショ ン	AE2 K W_AH0 Z_IH1 SH_AH0 N
ア ク ウィ ジ ショ ン	AE2 K W_AH0 Z_IH1 SH_AH0 N
ア ク イッ ト	AH0 K W_IH1 T
ア ク ウィッ ト	AH0 K W_IH1 T
エ ー カ ー	E Y1 K_E R0
エ イ カ ー	E Y1 K_E R0
ア ク リッ ド	AE1 K R_IH0 D
ア ク ロ バッ ト	AE1 K R_AH0 B_AE2 T
ア ク ロ バ チッ ク	AE2 K R_AH0 B_AE1 T_IH0 K
ア ク ロ バ ティッ ク	AE2 K R_AH0 B_AE1 T_IH0 K
ア ク ロ レ イ ン	AE1 K R_O W0 L_I Y2 N
ア ク ロ ニ ム	AE1 K R_AH0 N_IH0 M
ア ク ロ ポ リ ス	AH0 K R_AA1 P_AH0 L_AH0 S
ア ク ロ ス	AH0 K R_AO1 S
ア ク リ ル	AE1 K R_AH0 L
ア ク リ リッ ク レ ジ ン セ メ ン ト	AH0 K R_IH1 L_IH0 K R_EH1 Z_AH0 N S_AH0 M_EH1 N T
ア ク ト	AE1 K T
ア ク チ ン	AE1 K T_AH0 N
ア ク ティ ン グ	AE1 K T_IH0 N G
ア ク チ ナ イ ド	AE1 K T_IH0 N_A Y2 D
ア ク チ ニ ド	AE1 K T_IH0 N_A Y2 D
ア ク チ ノ イ ド	AE1 K T_IH0 N_A Y2 D
ア ク ショ ン	AE1 K SH_AH0 N
ア ク ティ ベ ー ト	AE1 K T_AH0 V_E Y2 T
ア ク ティ ベ ー ショ ン	AE2 K T_AH0 V_E Y1 SH_AH0 N
ア ク チ ベ ー タ	AE1 K T_AH0 V_E Y2 T_E R0
ア ク チ ベ ー タ ー	AE1 K T_AH0 V_E Y2 T_E R0
ア ク ティ ベ ー タ	AE1 K T_AH0 V_E Y2 T_E R0
ア ク ティ ベ ー タ ー	AE1 K T_AH0 V_E Y2 T_E R0
ア ク チ ブ	AE1 K T_IH0 V
ア ク ティ ヴ	AE1 K T_IH0 V
ア ク ティ ブ	AE1 K T_IH0 V
ア ク ティ ブ タ ー ミ ネ ー タ	AE1 K T_IH0 V T_E R1 M_IH0 N_E Y2 T_E R0
ア ク ティ ビ ズ ム	AE1 K T_IH0 V_IH2 Z_AH0 M
ア ク ティ ビ ス ト	AE1 K T_IH0 V_IH0 S T
ア ク ティ ヴィ ティ	AE0 K T_IH1 V_IH0 T_I Y0
ア ク ティ ヴィ ティ ー	AE0 K T_IH1 V_IH0 T_I Y0
ア ク ティ ビ ティ	AE0 K T_IH1 V_IH0 T_I Y0
ア ク ティ ビ ティ ー	AE0 K T_IH1 V_IH0 T_I Y0
ア ク テ ビ ティ	AE0 K T_IH1 V_IH0 T_I Y0
ア ク テ ビ ティ ー	AE0 K T_IH1 V_IH0 T_I Y0
ア ク ティ ビ ティ モ デ ル ス テッ プ	AE0 K T_IH1 V_IH0 T_I Y0 M_AA1 D_AH0 L S T_EH1 P
ア ク タ	AE1 K T_E R0
ア ク タ ー	AE1 K T_E R0
ア ク ト レ ス	AE1 K T R_AH0 S
ア ク チャ ル	AE1 K CH_AH0 W_AH0 L
ア ク チュ ア ル	AE1 K CH_AH0 W_AH0 L
ア ク チュ ア リ ティ ー	AE2 K CH_U W0 AE1 L_AH0 T_I Y2
ア ク チャ リ	AE1 K CH_U W2 AH0 L_I Y0
ア ク チュ ア リ	AE1 K CH_U W2 AH0 L_I Y0
ア ク チュ ア リ ー	AE1 K CH_U W0 EH1 R_I Y2
ア ク チュ エ ー タ	AE1 K TY_U W0 E Y2 T_E R0
ア ク チュ エ ー タ ー	AE1 K TY_U W0 E Y2 T_E R0
ア ク チュ エ タ	AE1 K TY_U W0 E Y2 T_E R0
ア ク チュ エ タ ー	AE1 K TY_U W0 E Y2 T_E R0
ア ド	AE1 D
ア ド ホッ ク	AE1 D HH_AA1 K
ア ド リ ブ	AE1 D L_IH1 B
ア ド ト ラッ ク	AE1 D T R_AH1 K
エ イ ダ	E Y1 D_AH0
ア ダ ー ジョ	AH0 D_AA1 ZH_I Y0 O W2
ア ダ ジ オ	AH0 D_AA1 ZH_I Y0 O W2
ア ダ プ ト	AH0 D_AE1 P T
ア ダ プ ト	AH0 D_AE1 P T
ア ダ プ テ ー ショ ン	AE2 D_AH0 P T_E Y1 SH_AH0 N
ア ダ プ タ	AH0 D_AE1 P T_E R0
ア ダ プ タ ー	AH0 D_AE1 P T_E R0
ア ダ プ ティ ヴ	AH0 D_AE1 P T_IH0 V
ア ダ プ ティ ブ	AH0 D_AE1 P T_IH0 V
ア ド イ ン	AE1 D IH0 N
ア ド オ ン	AE1 D AA1 N
ア ド ス ト リッ プ	AE1 D S T R_IH1 P
ア ディ ク ト	AH0 D_IH1 K T
ア ディ ショ ナ ル	AH0 D_IH1 SH_AH0 N_AH0 L
ア ドゥ レッ ス	AE1 D R_EH2 S
ア ド レ ス	AE1 D R_EH2 S
ア ド レ シ ン グ	AE0 D R_EH1 S_IH0 N G
ア ド レッ シ ン グ	AE0 D R_EH1 S_IH0 N G
ア デ ニ ン	AE1 D_AH0 N_I Y2 N
ア デ ノ イ ド	AE1 D_AH0 N_O Y2 D
ア デ ノ シ ン	AH0 D_EH1 N_AH0 S_I Y2 N
ア デ ノ ウ イ ル ス	AH0 D_EH1 N_AH0 V_A Y2 R_AH0 S
ア デ プ ト	AH0 D_EH1 P T
ア デュ ー	AH0 D_U W1
ア ディ オ ス	AA2 D_I Y0 O W1 S
ア ジェ イ サ ン ト	AH0 JH_E Y1 S_AH0 N T
ア ジェ イ ス ン ト	AH0 JH_E Y1 S_AH0 N T
ア ジェ ク ティ ブ	AE1 JH_IH0 K T_IH0 V
ア ジェ ク テ ブ	AE1 JH_IH0 K T_IH0 V
ア ジャ ス ト	AH0 JH_AH1 S T
ア ジャ ス タ ー	AH0 JH_AH1 S T_E R0
ア ジャ ス ト メ ン ト	AH0 JH_AH1 S T M_AH0 N T
ア ド ミ ン	AE1 D M_IH0 N
ア ド ミ ニ ス ト レ ー ショ ン	AE0 D M_IH2 N_IH0 S T R_E Y1 SH_AH0 N
ア ド ミ ニ ス ト レ ー タ	AH0 D M_IH1 N_IH0 S T R_E Y2 T_E R0
ア ド ミ ニ ス ト レ ー タ ー	AH0 D M_IH1 N_IH0 S T R_E Y2 T_E R0
ア ド ミ ラ ル	AE1 D M_E R0 AH0 L
ア ド ミッ ショ ン	AE0 D M_IH1 SH_AH0 N
ア ド ミ タ ン ス	AH0 D M_IH1 T_AH0 N S
ア ド ミッ タ ン ス	AH0 D M_IH1 T_AH0 N S
ア ド ー ビ	AH0 D_O W1 B_I Y0
ア ド ビ	AH0 D_O W1 B_I Y0
ア ド ベ	AH0 D_O W1 B_I Y0
ア ド レ セ ン ス	AE2 D_AH0 L_EH1 S_AH0 N S
ア ダ プ ショ ン	AH0 D_AA1 P SH_AH0 N
ア ド プ ショ ン	AH0 D_AA1 P SH_AH0 N
ア ド レ ナ リ ン	AH0 D R_EH1 N_AH0 L_IH0 N
ア ダ ル ト	AH0 D_AH1 L T
ア ダ ル ト チ ル ド レ ン	AH0 D_AH1 L T CH_IH1 L D R_AH0 N
ア ド ヴァ ン ス	AH0 D V_AE1 N S
ア ド バ ン ス	AH0 D V_AE1 N S
ア ド ヴァ ン ス ト	AH0 D V_AE1 N S T
ア ド バ ン ス ト	AH0 D V_AE1 N S T
ア ド バ ン ス ド	AH0 D V_AE1 N S T
ア ド ヴァ ン テ ー ジ	AE0 D V_AE1 N T_IH0 JH
ア ド バ ン テ ー ジ	AE0 D V_AE1 N T_IH0 JH
ア ド バ ン テッ ジ	AE0 D V_AE1 N T_IH0 JH
ア ド ヴェ ン ト	AE1 D V_EH2 N T
ア ド ベ ン ト	AE1 D V_EH2 N T
ア ド ヴェ ン チャ ー	AE0 D V_EH1 N CH_E R0
ア ド ベ ン チャ ー	AE0 D V_EH1 N CH_E R0
ア ドゥ ベ ン チャ ラ ス	AE0 D V_EH1 N CH_E R0 AH0 S
ア ド ベ ン チャ ラ ス	AE0 D V_EH1 N CH_E R0 AH0 S
ア ドゥ バ タ イ ズ メ ン ト	AE0 D V_E R1 T_AH0 Z M_AH0 N T
ア ド バ タ イ ズ メ ン ト	AE0 D V_E R1 T_AH0 Z M_AH0 N T
ア ド バ タ イ ジ ン グ	AE1 D V_E R0 T_A Y2 Z_IH0 N G
ア ド ヴァ イ ス	AE0 D V_A Y1 S
ア ド バ イ ス	AE0 D V_A Y1 S
ア ド ヴァ イ ザ ー	AE0 D V_A Y1 Z_E R0
ア ド バ イ ザ ー	AE0 D V_A Y1 Z_E R0
ア ド バ イ ザ リ	AE0 D V_A Y1 Z_E R0 I Y0
ア ド バ イ ザ リ ー	AE0 D V_A Y1 Z_E R0 I Y0
ア ド ボ カ シ ー	AE1 D V_AH0 K_AH0 S_I Y0
イ ー ジ ス	I Y1 JH_AH0 S
エ イ ジ ス	I Y1 JH_AH0 S
エ ア リ ア ル	EH1 R_I Y0 AH0 L
エ ア ロ	EH1 R_O W0
エ ア ロ パ ー ツ	EH1 R_O W0 P_AA1 R T S
エ ア ロ ビ ク ス	E R0 O W1 B_IH0 K S
エ ア ロ ダ イ ナ ミッ ク ス	EH2 R_O W0 D_A Y0 N_AE1 M_IH0 K S
エ ー ロ ゾ ル	EH1 R_AH0 S_AA2 L
エ ア ゾ ー ル	EH1 R_AH0 S_AA2 L
エ ア ロ ゾ ル	EH1 R_AH0 S_AA2 L
ア フェ ア	AH0 F_EH1 R
ア フェ ア ー	AH0 F_EH1 R
ア フェ ク ショ ン	AH0 F_EH1 K SH_AH0 N
ア フィ リ エ ー ト	AH0 F_IH1 L_I Y0 E Y2 T
ア フィ リ エ イ ト	AH0 F_IH1 L_I Y0 E Y2 T
ア フェ リ エ ー ト	AH0 F_IH1 L_I Y0 E Y2 T
ア フェ リ エ イ ト	AH0 F_IH1 L_I Y0 E Y2 T
ア フィ リ エ ー ト ブ ロ グ	AH0 F_IH1 L_I Y0 E Y2 T B L_AO1 G
ア フィ リ エ ー ト プ ロ グ ラ ム	AH0 F_IH1 L_I Y0 E Y2 T P R_O W1 G R_AE2 M
ア フィ リ エ イ ト プ ロ グ ラ ム	AH0 F_IH1 L_I Y0 E Y2 T P R_O W1 G R_AE2 M
ア フィ ニ ティ	AH0 F_IH1 N_IH0 T_I Y0
ア ファ ー マ ティ ブ	AH0 F_E R1 M_AH0 T_IH0 V
ア フ ガ ン	AE1 F G_AE2 N
ア フ ラ ト キ シ ン	AE2 F L_AH0 T_AA1 K S_IH0 N
ア フ リ カ ン ア メ リ カ ン	AE1 F R_IH0 K_AA0 N AH0 M_EH1 R_IH0 K_AH0 N
ア フ リ カ ー ン ス	AE2 F R_AH0 K_AA1 N Z
ア フ カ ー ナ	AE2 F R_AH0 K_AA1 N_E R0
ア フ ロ	AE1 F R_O W0
ア フ ロ カ リ ビ ア ン	AE1 F R_O W0 K_EH0 R_IH1 B_I Y2 AH0 N
ア フ ロ キュ ー バ ン リ ズ ム	AE1 F R_O W0 KY_U W1 B_AH0 N R_IH1 DH_AH0 M
ア ー フ タ	AE1 F T_E R0
ア フ タ ー	AE1 F T_E R0
ア フ タ ー シェ ー ブ ロ ー ショ ン	AE1 F T_E R0 SH_E Y1 V L_O W1 SH_AH0 N
ア フ タ ー バ ー ナ ー	AE1 F T_E R0 B_E R2 N_E R0
ア フ タ ー マ ー ケッ ト	AE1 F T_E R0 M_AA2 R K_IH0 T
ア ー フ タ ヌ ー ン	AE2 F T_E R0 N_U W1 N
ア フ タ ー ヌ ー ン	AE2 F T_E R0 N_U W1 N
ア フ タ ヌ ー ン	AE2 F T_E R0 N_U W1 N
ア ー フ タ ワ ー ズ	AE1 F T_E R0 W_E R0 D Z
ア ゲ ー ン	AH0 G_EH1 N
ア ゲ イ ン	AH0 G_EH1 N
ア ゲ ン	AH0 G_EH1 N
ア ゲィ ン ス ト	AH0 G_EH1 N S T
ア ゲ イ ン ス ト	AH0 G_EH1 N S T
ア ゲ ン ス ト	AH0 G_EH1 N S T
エ ー ジ	E Y1 JH
エ イ ジ	E Y1 JH
エ ー ジ グ ル ー プ	E Y1 JH G R_U W1 P
エ ー ジ ハ ラ ス メ ン ト	E Y1 JH HH_E R0 AE1 S M_AH0 N T
エ ー ジ レ ス	E Y1 JH L_AH0 S
エ イ ジ レ ス	E Y1 JH L_AH0 S
エ ー ジェ ン シ ー	E Y1 JH_AH0 N S_I Y0
エ イ ジェ ン シ ー	E Y1 JH_AH0 N S_I Y0
ア ジェ ン ダ	AH0 JH_EH1 N D_AH0
エ ー ジェ ン ト	E Y1 JH_AH0 N T
エ ー ジ ン ト	E Y1 JH_AH0 N T
エ イ ジェ ン ト	E Y1 JH_AH0 N T
ア ゲ ラ タ ム	AH0 JH_EH1 R_AH0 T_AH0 M
ア グ ロ メ レ ー ショ ン	AH0 G L_AA2 M_E R0 E Y1 SH_AH0 N
ア グ ラ ベ イ ト	AE1 G R_AH0 V_E Y2 T
ア グ リ ベ イ ト	AE1 G R_AH0 V_E Y2 T
ア グ リ ゲ イ ショ ン	AE2 G R_AH0 G_E Y1 SH_AH0 N
ア グ レ ゲ イ ショ ン	AE2 G R_AH0 G_E Y1 SH_AH0 N
ア グ レ ショ ン	AH0 G R_EH1 SH_AH0 N
ア グ レッ ショ ン	AH0 G R_EH1 SH_AH0 N
ア グ レッ シ ン	AH0 G R_EH1 SH_AH0 N
ア グ レ シ ヴ	AH0 G R_EH1 S_IH0 V
ア グ レ シ ブ	AH0 G R_EH1 S_IH0 V
ア グ レッ シ ヴ	AH0 G R_EH1 S_IH0 V
ア グ レッ シ ブ	AH0 G R_EH1 S_IH0 V
ア ジャ イ ル ー	AE1 JH_AH0 L
ア ジ リ ティ	AH0 JH_IH1 L_AH0 T_I Y0
ア ジ リ ティ ー	AH0 JH_IH1 L_AH0 T_I Y0
エ ー ジ ン グ	E Y1 JH_IH0 N G
エ イ ジ ン グ	E Y1 JH_IH0 N G
ア ジ テ ー ト	AE1 JH_AH0 T_E Y2 T
ア ジ テ イ ト	AE1 JH_AH0 T_E Y2 T
ア ジ テ ー ショ ン	AE2 JH_AH0 T_E Y1 SH_AH0 N
ア ジ テ イ ショ ン	AE2 JH_AH0 T_E Y1 SH_AH0 N
ア ジ テ ー タ ー	AE1 JH_AH0 T_E Y2 T_E R0
ア ガ ナ イ ズ	AE1 G_AH0 N_A Y2 Z
ア ゴ ラ	AE1 G_E R0 AH0
ア ゴ ラ フォ ビ ア	AH0 G_AO2 R_AH0 F_O W1 B_I Y0 AH0
ア グ リ	AH0 G R_I Y1
ア グ リ ー	AH0 G R_I Y1
ア グ レ ア ブ ル	AH0 G R_I Y1 AH0 B_AH0 L
ア グ リ ー メ ン ト	AH0 G R_I Y1 M_AH0 N T
ア グ リ メ ン ト	AH0 G R_I Y1 M_AH0 N T
ア グ リ ビ ジ ネ ス	AE1 G R_AH0 B_IH2 Z N_AH0 S
ア グ リ カ ル チュ ラ ル	AE2 G R_IH0 K_AH1 L CH_E R0 AH0 L
ア グ リ カ ル チャ	AE1 G R_IH0 K_AH2 L CH_E R0
ア グ リ カ ル チャ ー	AE1 G R_IH0 K_AH2 L CH_E R0
エ イ ド	E Y1 D
エ ル ロ ン	E Y1 L_E R0 AA2 N
エ イ ム	E Y1 M
ア イ ヌ	E Y1 N_U W2
エ ア	EH1 R
エ ア ー	EH1 R
エ ヤ ー	EH1 R
エ ア コ ン	EH1 R K_AA1 N
エ ヤ コ ン	EH1 R K_AA1 N
エ ア マッ ト	EH1 R M_AE1 T
エ ア サ ス ペ ン ショ ン	EH1 R S_AH0 S P_EH1 N SH_AH0 N
エ ア ボ ー ト	EH1 R B_O W0 T
エ ア ボ ー ン	EH1 R B_AO2 R N
エ ア ク ラ フ ト	EH1 R K R_AE2 F T
エ ア フィ ー ル ド	EH1 R F_I Y2 L D
エ ア ラ イ ン	EH1 R L_A Y2 N
エ ア ポ ー ト	EH1 R P_AO2 R T
エ ア シッ プ	EH1 R SH_IH2 P
エ ア ウェ ー	EH1 R W_E Y2
エ ア ウェ イ	EH1 R W_E Y2
ア イ ル	A Y1 L
ア ル メ ー ル	AE1 L M_E Y1 L
ア ラ バ マ	AE2 L_AH0 B_AE1 M_AH0
ア ラ バ ス タ ー	AE1 L_AH0 B_AE2 S T_E R0
ア ラ ン	AE1 L_AH0 N
ア ラ ー ム	AH0 L_AA1 R M
ア ラ ス カ	AH0 L_AE1 S K_AH0
ア ル バ ニ ア	AE0 L B_E Y1 N_I Y0 AH0
ア ル バ ト ロ ス	AE1 L B_AH0 T R_AA2 S
ア ル ビ ー ノ	AE0 L B_A Y1 N_O W2
ア ル ビ ノ	AE0 L B_A Y1 N_O W2
ア ル バ ム	AE1 L B_AH0 M
ア ル ブ ミ ン	AE0 L BY_U W1 M_AH0 N
ア ル カ ン タ ー ラ	AA0 L K_AA0 N T_AA1 R_AH0
ア ル コ ー ル	AE1 L K_AH0 HH_AA2 L
ア ル コ ホ ル	AE1 L K_AH0 HH_AA2 L
ア ル コ ー ブ	AE1 L K_O W2 V
ア ル デ バ ラ ン	AE0 L D_EH1 B_E R0 AH0 N
ア ル ド リ ン	AO1 L D R_IH0 N
エ ー ル	E Y1 L
ア ー レ フ	AA1 L_AH0 F
ア レ フ	AA1 L_AH0 F
ア ラ ー ト	AH0 L_E R1 T
ア ル ファ ル ファ	AE2 L F_AE1 L F_AH0
ア ル ジェ リ ア	AE0 L JH_IH1 R_I Y0 AH0
ア ル ジェ	AE0 L JH_IH1 R Z
ア ル ゴ ル	AE1 L G_AA0 L
ア ル ゴ リ ズ ム	AE1 L G_E R0 IH2 DH_AH0 M
ア ル ゴ リ ズ ミッ ク	AE1 L G_E R0 IH2 DH_AH0 M_IH0 K
エ イ リ ア ス	E Y1 L_I Y0 AH0 S
ア リ バ イ	AE1 L_AH0 B_A Y2
エ ー リ ア ン	E Y1 L_I Y0 AH0 N
エ イ リ ア ン	E Y1 L_I Y0 AH0 N
ア ラ イ メ ン ト	AH0 L_A Y1 N M_AH0 N T
ア ラ イ ン メ ン ト	AH0 L_A Y1 N M_AH0 N T
ア ラ イ ン メ ン ト テ ス ト イ メ ー ジ	AH0 L_A Y1 N M_AH0 N T T_EH1 S T IH1 M_AH0 JH
ア ラ イ ブ	AH0 L_A Y1 V
ア ー リ ヤ ー	AH0 L_I Y1 AH0
ア リ ー ヤ ー	AH0 L_I Y1 AH0
ア リ ヤ ー	AH0 L_I Y1 AH0
ア ル カ ロ イ ド	AE1 L K_AH0 L_O Y2 D
ア ル ケ ン	AE1 L K_I Y2 N
オ ー ル イ ン ワ ン	AO1 L IH0 N W_AH1 N
オ ー ル ジャ パ ン	AO1 L JH_AH0 P_AE1 N
オ ー ル ラ ス ト	AO1 L L_AE1 S T
オ ー ル ロ ケ ー ショ ン	AO1 L L_O W0 K_E Y1 SH_AH0 N
オ ー ル ナ イ ト	AO1 L N_A Y1 T
オ ー ル オ ア ナ シ ン グ	AO1 L AO1 R N_AH1 TH_IH0 N G
オ ー ル オ ア ナッ シ ン グ	AO1 L AO1 R N_AH1 TH_IH0 N G
オ ー ル オ ー ディ ナ リ ー ズ	AO1 L AO1 R D_AH0 N_EH2 R_I Y0 Z
オ ー ル パ ー パ ス	AO1 L P_E R1 P_AH0 S
オ ー ル ラ イ ト	AO1 L R_A Y1 T
オ ー ル リ ス ク ス	AO1 L R_IH1 S K S
オ ー ル ラ ウ ン ド	AO1 L R_A W1 N D
オ ー ル ラ ウ ン ダ ー	AO1 L R_A W1 N D_E R0
オ ー ル シ ー ズ ン コ ー ト	AO1 L S_I Y1 Z_AH0 N K_O W1 T
オ ー ル シ ー ズ ン ド レ ス	AO1 L S_I Y1 Z_AH0 N D R_EH1 S
オ ー ル タ イ ム	AO1 L T_A Y1 M
オ ー ル ウェ ザ ー	AO1 L W_EH1 DH_E R0
オ ー ル ウ エ ザ ー	AO1 L W_EH1 DH_E R0
アッ ラ ー	AA1 L_AH0
ア ラ ー	AA1 L_AH0
ア レ ゴ リ ー	AE1 L_AH0 G_AO2 R_I Y0
アッ レ グ ロ	AH0 L_EH1 G R_O W2
ア レ グ ロ	AH0 L_EH1 G R_O W2
ア レ ル	AH0 L_EH1 L_I Y0
ア レ ル ゲ ン	AE1 L_E R0 JH_AH0 N
ア レ ル ギ ー	AE1 L_E R0 JH_I Y0
ア レ ー	AE1 L_I Y0
ア レ イ	AE1 L_I Y0
ア ラ イ ア ン ス	AH0 L_A Y1 AH0 N S
ア リ ゲ ー タ ー	AE1 L_AH0 G_E Y2 T_E R0
ア ロ ケ ー ト	AE1 L_AH0 K_E Y2 T
ア ロ ケ ー ショ ン	AE2 L_AH0 K_E Y1 SH_AH0 N
ア ラ ウ ア ン ス	AH0 L_A W1 AH0 N S
ア ロ ー ア ン ス	AH0 L_A W1 AH0 N S
ア ロ ー ワ ン ス	AH0 L_A W1 AH0 N S
ア ロ ウ ア ン ス	AH0 L_A W1 AH0 N S
ア ロ イ	AE1 L_O Y2
オ ー ル ス パ イ ス	AO1 L S P_A Y2 S
ア ル マ ナッ ク	AA1 L M_AH0 N_AE2 K
オ ー ル マ イ ティ	AO0 L M_A Y1 T_I Y0
オ ー ル マ イ ティ ー	AO0 L M_A Y1 T_I Y0
ア ー モ ン ド	AA1 M_AH0 N D
ア モ ン ド	AA1 M_AH0 N D
ア ロ エ	AE1 L_O W2
ア ロ ハ	AH0 L_O W1 HH_AA0
ア ロ ー ン	AH0 L_O W1 N
ア ル パ カ	AE0 L P_AE1 K_AH0
ア ル ファ チャ ネ ル	AE1 L F_AH0 CH_AE1 N_AH0 L
ア ル ファ テ ス ト	AE1 L F_AH0 T_EH1 S T
ア ル ファ バ ー ジョ ン	AE1 L F_AH0 V_E R1 ZH_AH0 N
ア ル ファ ベッ ト	AE1 L F_AH0 B_EH2 T
ア ル ファ ニュ ー メ リッ ク	AE2 L F_AH0 N_U W0 M_EH1 R_IH0 K
ア ル パ イ ン	AE1 L P_A Y2 N
ア ル プ ス	AE1 L P S
オ ル ト キ ー	AA1 L T K_I Y1
ア ル タ イ ル	AA0 L T_EH1 R
ア ル タ ビ ス タ	AO2 L T_AH0 V_IH1 S T_AH0
オ ル タ ネ イ ト	AO1 L T_E R0 N_AH0 T
オ ー ル タ ー ナ ティ ブ	AO0 L T_E R1 N_AH0 T_IH0 V
オ ー ル タ ナ ティ ブ	AO0 L T_E R1 N_AH0 T_IH0 V
オ ル タ ー ナ ティ ヴ	AO0 L T_E R1 N_AH0 T_IH0 V
オ ル タ ー ナ ティ ブ	AO0 L T_E R1 N_AH0 T_IH0 V
オ ル タ ナ ティ ヴ	AO0 L T_E R1 N_AH0 T_IH0 V
オ ル タ ナ ティ ブ	AO0 L T_E R1 N_AH0 T_IH0 V
オ ル タ ネ ー タ ー	AO1 L T_E R0 N_E Y2 T_E R0
オ ル タ ネ タ	AO1 L T_E R0 N_E Y2 T_E R0
ア ル ティ プ ラ ー ノ	AE2 L T_AH0 P L_AA1 N_O W2
ア ル ティ プ ラ ノ	AE2 L T_AH0 P L_AA1 N_O W2
ア ル ト	AE1 L T_O W0
オ ル ト ル イ ズ ム	AE1 L T R_U W0 IH2 Z_AH0 M
ア ル ミ ナ	AH0 L_U W1 M_AH0 N_AH0
ア ル ミ ニ ウ ム	AH0 L_U W1 M_AH0 N_AH0 M
ア ル ミ ニュ ー ム	AH0 L_U W1 M_AH0 N_AH0 M
ア ル ツ ハ イ マ ー	AE1 L Z HH_A Y2 M_E R0
ア マ ー ビ レ	AA0 M_AA1 B_AH0 L
ア マ ル ガ ム	AH0 M_AE1 L G_AH0 M
ア マ ン	AA0 M_AA1 N T_I Y0
ア マ ラ ン ス	AE1 M_E R0 AE2 N TH
ア マ レッ ト	AE0 M_AH0 R_EH1 T_O W0
ア マ リ リ ス	AE2 M_E R0 IH1 L_IH0 S
ア マ チュ ア	AE1 M_AH0 CH_E R2
ア マ チュ ア オ ー ケ ス ト ラ	AE1 M_AH0 CH_E R2 AO1 R K_AH0 S T R_AH0
ア マ チュ ア レ ス リ ン グ	AE1 M_AH0 CH_E R2 R_EH1 S L_IH0 N G
ア マ チュ ア リ ズ ム	AE1 M_AH0 CH_E R2 IH0 Z_AH0 M
ア メ ー ジ ン グ	AH0 M_E Y1 Z_IH0 N G
ア メ イ ジ ン グ	AH0 M_E Y1 Z_IH0 N G
ア マ ゾ ー ン	AE1 M_AH0 Z_AA2 N
ア マ ゾ ン	AE1 M_AH0 Z_AA2 N
ア マ ゾ ニ ス	AE1 M_AH0 Z_AA2 N Z
ア マ ゾ ネ ス	AE1 M_AH0 Z_AA2 N Z
ア ン バ サ ダ ー	AE0 M B_AE1 S_AH0 D_E R0
ア ン バ ー	AE1 M B_E R0
ア ン バ ー グ リ ス	AE1 M B_E R0 G R_IH0 S
ア ン ビ ア ン ス	AE1 M B_I Y0 AH0 N S
ア ン ビ エ ン ト	AE1 M B_I Y0 AH0 N T
ア ン ビ ギュ イ ティ	AE2 M B_IH0 GY_U W1 AH0 T_I Y0
ア ン ビ ショ ン	AE0 M B_IH1 SH_AH0 N
ア ン ビ シャ ス	AE0 M B_IH1 SH_AH0 S
ア ン ビ ヴァ レ ン ス	AE0 M B_IH1 V_AH0 L_AH0 N S
ア ン ビ バ レ ン ス	AE0 M B_IH1 V_AH0 L_AH0 N S
ア ン ビ バ レ ン ツ	AE0 M B_IH1 V_AH0 L_AH0 N T
ア ン ビ バ レ ン ト	AE0 M B_IH1 V_AH0 L_AH0 N T
ア ン ビュ ラ ン ス	AE1 M BY_AH0 L_AH0 N S
ア ン ブッ シュ	AE1 M B_UH2 SH
エ ー エ ム ー ディ ー	E Y1 EH2 M D_I Y1
ア ー メ ン	E Y0 M_EH1 N
エ イ メ ン	E Y0 M_EH1 N
ア メ ン ド	AH0 M_EH1 N D
ア メ ン ド メ ン ト	AH0 M_EH1 N D M_AH0 N T
ア メ ニ ティ	AH0 M_EH1 N_AH0 T_I Y0
ア メ ニ ティ ー	AH0 M_EH1 N_AH0 T_I Y0
ア メ リ カ	AH0 M_EH1 R_IH0 K_AH0
ア メ リ カ ン	AH0 M_EH1 R_IH0 K_AH0 N
ア メ リ カ ン ブ ルッ ク ラ ン プ リ	AH0 M_EH1 R_IH0 K_AH0 N B R_UH1 K L_AE1 M P R_I Y0
ア メ リ カ ン カ ジュ ア ル ー	AH0 M_EH1 R_IH0 K_AH0 N K_AE1 ZH_AH0 W_AH0 L
ア メ リ カ ン コ ミッ ク ス	AH0 M_EH1 R_IH0 K_AH0 N K_AA1 M_IH0 K S
ア メ リ カ ン フッ ト ボ ー ル	AH0 M_EH1 R_IH0 K_AH0 N F_UH1 T B_AO2 L
ア メ リ カ ン リ ー グ	AH0 M_EH1 R_IH0 K_AH0 N L_I Y1 G
ア メ リ カ ミ ン ク	AH0 M_EH1 R_IH0 K_AH0 N M_IH1 N G K
ア メ リ カ ン ラ グ ビ ー	AH0 M_EH1 R_IH0 K_AH0 N R_AH1 G B_I Y0
ア メ リ カ ン ス ク ー ル	AH0 M_EH1 R_IH0 K_AH0 N S K_U W1 L
ア メ リ カ ン ショ ー ト ヘ ア	AH0 M_EH1 R_IH0 K_AH0 N SH_AO1 R T HH_EH2 R
ア メ リ カ ニ ズ ム	AH0 M_EH1 R_IH0 K_AH0 N_IH2 Z_AH0 M
ア メ リ カ ナ イ ゼ ー ショ ン	AH0 M_EH2 R_IH0 K_AH0 N_AH0 Z_E Y1 SH_AH0 N
ア メ リ カ ニ ゼ ー ショ ン	AH0 M_EH2 R_IH0 K_AH0 N_AH0 Z_E Y1 SH_AH0 N
ア メ リ カ ナ イ ズ	AH0 M_EH1 R_IH0 K_AH0 N_A Y2 Z
ア メ リ カ ー ノ	AH0 M_EH2 R_IH0 K_AA1 N_O W0
ア メ リ シ ウ ム	AH0 M_EH0 R_IH1 S_I Y2 AH0 M
ア メ シ ス ト	AE1 M_IH0 TH_IH0 S T
ア メ ジ ス ト	AE1 M_IH0 TH_IH0 S T
ア ミ	AA1 M_I Y0
ア ミ ド	E Y1 M_A Y2 D
ア ミ ー ガ	AH0 M_I Y1 G_AH0
ア ミ ー ゴ	AH0 M_I Y1 G_O W2
ア ミ ゴ	AH0 M_I Y1 G_O W2
ア ミ ン	E Y2 M_I Y1 N
ア ミ ノ	AH0 M_I Y1 N_O W0
ア ミ ー ル	AH0 M_IH1 R
ア ー ミッ シュ	AA1 M_IH0 SH
ア ミ ティ	AE1 M_IH0 T_I Y0
ア ン マ ン	AE1 M_AH0 N
ア ン メ ー タ ー	AE1 M_I Y2 T_E R0
ア ン モ ニ ア	AH0 M_O W1 NY_AH0
ア ン モ ナ イ ト	AE1 M_AH0 N_A Y2 T
ア ン モ ニ ウ ム	AH0 M_O W1 N_I Y0 AH0 M
ア ム ネ ス ティ	AE1 M N_AH0 S T_I Y0
